basepk,hid,speechdate,pid,opid,speakeroldname,speakerposition,maintopic,subtopic,subsubtopic,speechtext,speakerparty,speakerriding,speakername,speakerurl
33466,ca.proc.d.1902-04-07.7.2.1,1902-04-07,5bfd2fe5-bfe6-42c4-9503-71c3b6f865df,ca.m.5370,Mr. HAUGHTON LENNOX (South Sim-coe).,,WAYS AND MEANS-THE BUDGET.,,,"Before resuming the course of the argument, I was endeavouring to present to the House when the debate was adjourned on Friday evening, I wish to call attention to a paragraph which appears in the Montreal ' Herald ' :
The opposition's story was told by two members in succession, Mr. Broder and Mr. Lennox. Both

told the same story of broken pledges and big expenditures and made the same apologies for the prosperity of tile country that have been made by all the Conservative speakers.
Items of- this character are not, in themselves, important. But inasmuch as neither the hon. gentleman Who preceded me nor myself addressed our arguments in the line spoken of, I wish to call the attention of the House to the fact, and also for the reason that we find this organ supporting the government-and it appears, as some one says, a subsidized organ-in this instance, as in some other instances, has referred to arguments as being advanced by this side of the House which were not advanced. We know that conscience makes cowards of us all, and the Liberal party, conscious of their weakness in these matters as well as in a variety of other matters, imagine that the opposition must be talking of this matter' even though they do not refer to it.
Now, when I concluded my remarks the other evening, X was referring to the condition of the country in 1878, and was pointing out the deplorable condition in which the country then stood. Canada had in fact reached the parting of the ways; it was more than the parting of the ways, because the government had acknowledged defeat, they had acknowledged that they were unable from the resources of the country, to carry on the affairs of the country. Canada had, in a commercial and industrial sense, actually abandoned the field, and was going backwards. I need not remind the House who came to the rescue on that occasion. He may be an efficient general who, upon the battle field, casts about him to ascertain the position of the enemy, the strength of the enemy, and lines up his own army in an efficient battle array. He is perhaps a brilliant general who, when victory trembles in the balance, rushes to the head of his forces, stays a threatened retreat, and holds them in line. But, Sir, he is a prince of soldiers who, when panic has set in, when confidence has been lost, when the army nas commenced to retreat, when all seems lost, comes and rallies the soldiers, stays their retreat, and ultimately, after reorganizing them, leads them on to victory. I need not tell the House who was that man, that father of his country, that saviour of Canada, in 1878.	[DOT]
Now, this newspaper says that I referred to the prosperity of the country, and tried to apologize for it. X do not need to apologize for the success of the country. The success of the country, as is known to every thoughtful Canadian, as is known to every statesman the world around, is owing to two things, and two things alone : To the general prosperity of the commercial world and to the magnificent policy, so far as it relates to Canada, that was Inaugurated in 1878. I refer now to the condition of things which succeeded the declaration of policy, and the magnificent campaign that Mr. LENNOX.
was carried on by the Conservative party, ably led by Sir John A. Macdonald, the greatest Canadian statesman, and one of the greatest statesmen of the British Empire. Almost immediately that declaration of Sir John A. Macdonald reanimated the country. I wish to point out this fact, that you may make your policies what you will, you may argue as you will, but unless you animate a country with hope, unless you can point It to something to be accomplished, you will never succeed in building up a nation. So I cast back the statement of the Minister of Agriculture when he told us, in winding up that somewhat tedious speech of his the other day, as a conclusion of the whole matter, that the future of the country must take care of itself. If that is the theory of the Minister of Agriculture for assisting this country, if tliaf is all he can do for agriculture, if he cannot point to a line of policy which will develop the varied resources of this country, if he cannot adapt himself to changing conditions and map out a line of conduct which will enable ns to compete for the commerce of the world with other nations, then I submit that the country will pronounce him not exactly fit for the position he occupies.
Now, after 1S78, after the victory that was then achieved, it goes without saying that Sir John A- Macdonald inaugurated the policy upon which he won. The Conservative party, Mr. Speaker, always carried out in the House the policy which they advocated in the country. I tell the hon. gentlemen opposite who talk about standing by the old policy of 1878, and that we stood, and stand, by the old policy of redeeming our pledges made to the people at the time of the elections. We had great success by reason of the national policy introduced by Sir John A. Macdonald, but we had not complete success, and perhaps that admission will give a grain of comfort to the cabinet and their followers. I have said that absolute certainty of the continuance of a policy is essential to its successful operation. After Sir John A. Macdonald inaugurated the policy, what attitude did the opposition of that day assume ? Why, Sir, instead of acting like a loyal opposition in the Interests of the country, instead of giving the policy a fair trial, they went up and down the country, many of them saying what they did not believe, traducing the policy, and declaring that it would be reversed on the first opportunity, trying to drive the young men out of this country, trying to stem the tide of immigration into this country. The Minister of Trade and Commerce (Sir Richard Cartwright), more unfaithful than most of his party, by his speeches in this House and throughout the country, by his writings in English papers such as the ' Economist ' did not cease to vilify the policy and administration of the Conservative party, to disgrace Canada, to deter immigrants from coming here and

to drive away our young men from this country.
I say it is the essence of a policy that it should be stable, and therefore it is little wonder that at the present time these gentlemen can point to some measure of success. They are' practically carrying out the policy- that was inaugurated by our great Canadian statesman, they have enforced it in a large degree, and to that fact I attribute the prosperity which the country now enjoys ; and so far as that policy fails to procure for Canada all the prosperity which she ought to enjoy, it is owing to the fact that they have tinkered with the tariff, and have never risen to the height of realizing its full scope, nor have they adequately carried it out.
1 will tell these hon. gentlemen a story, and they have always been fond of American authorities until recently, that was told by Chauncey Depew. He said that some few years ago there was in a village not far from the city of New York an excitement because it had been proclaimed that the end of the world would occur on a certain night at twelve o'clock. It unsettled the minds of the people as uncertainty of the future always does unsettle and unhinge people's minds. Some of the people sold their property at a sacrifice, some abandoned work and on the last day a number of them-and I trust hon. gentlemen on the other side of the House will take this lesson to heart-began to pray. Among them was an old shoemaker who had promised a pair of boots to Mrs. Brown for the next day. He prayed fervently, and as it approached twelve o'clock he prayed more fervently still. When it came to twelve o'clock he found that no change had occurred, but he thought that it would be better to pray a little longer. There might be a difficulty about the exact time. He continued praying for perhaps half an hour and then said-and this is the point I wish to impress upon hon. gentlemen opposite as to the necessity of certainty in fiscal matters-O Lord, if the end of the world is coming, let me know right now, but if the end of the world is not coming, O Lord may it please you to say so, because I must have Mrs. Brown's boots ready at twelve o'clock to-morrow ; there is nothing that knocks business out like this uncertainty. We have had, therefore, a better state of things since the government came into office in that regard. We have not had a disloyal opposition, but we have had a loyal opposition, not traducing the country but willing to give the government a fair chance to carry on public affairs. We have not had a complaining opposition, but we have had members on ooth sides of the . House uniting, whether acknowledging it or not, bceause the government has not had the candour to acknowledge it, in upbuilding the national policy and the policy of protection in this country, so that with a ready made policy and with a loyal opposition
supporting it, taken in conjunction with years of great plenty, we should have comparative success. Now, I wish to refer to some circumstances which are unique in a sense in connection with this debate. We have a decidedly unusual state of things. In the words of the man in the street, 'things are coming our way.' First, we have the hon. member for North Norfolk (Mr. Charlton), and his speech is yet fresh in our minds. I venture to say that a more significant speech, one of more far-reaching effect, one that is more calculated to shake the confidence of the people of Canada and of the world, for that matter, in the truth and candour of the existing government has not been uttered. Taken in connection with the statement of the right hon. leader of the government (Sir Wilfrid Laurier) in reference to the Minister of Trade and Commerce, and with the utterances of the hon. Minister of Trade and Commerce (Sir Richard Cartwright), who is declared to have taken exactly the same line as the-hon. member for North Norfolk, it establishes beyond refutation that for a quarter of a century we have had the leading men of the Reform party, the men whom the Reform party looked up to, the men whom they believed to be honest, going about this country proclaiming that which they did not believe to be true and denouncing and defaming the policy in which they actually believed. A more significant state of tilings has not existed in Canada for a long time. Now, there is more than that. We have what we would expect and what does not trouble my mind at all, and that is a good deal of wrangling in that party over that same speech. We have the hon. member for Russell (Mr. Edwards) on the right and the hon. member for Guysborough (Mr. Fraser) on the left, who, with the hon. member for North Norfolk, are the leaders of the Liberal party outside of the government, and we have these two hon. gentlemen attacking the hon. member for North Norfolk. At the same time we have the hon. member for Russell attacking and threatening the government. He is getting-shaky about the government; he does not know where they stand ; and who does know where they stand ? Is there a man in Canada, who. if you -were to divide that government, knows how many would stand on one side and how many on the other ?	1
do not know. . He holds them up-and history repeats itself-as they were held up in 1878 by a contingent from the maritime provinces. He says : Go one step farther and I will denounce you. An hon. member on the other side of the House farther back, on Friday evening did the same thing. So it is all over the House. The hon. member for Russell speaks as if he were in earnest. I do not know whether he is or not. I would believe every word he uttered was perfectly sincere only for one thing, which makes me feel that I do not know where 1 stand in that regard, and that is the fact

country when in the nature of things changes must be made ; it seems that these gentlemen are not able and have not the ability or have not the courage to announce a policy for themselves, and so they say from time to time :	What is the policy of
the Conservative party, and what is the meaning of the declaration of the policy that has been enunciated toy Conservatives from session to session. In reply to these gentlemen that it is a definite policy; that it is a policy which so far as one can see, the Reform party has not been able to frame. The fact of its being a policy at all makes it what the Reform party are frequently looking for, what they have not been able to find, and what I venture to say-having regard to their actions in the past-they would not have the courage to enunciate even though they found it, because they want to see the way the wind blows before they declare a policy one way or the other. The policy of the Conservative party is not a patchwork policy ; it is not-If I return to the story of Joseph-a patch-work like Joseph's coat, to be worn one side out or the other side just as happens to suit the exigencies of the case ; with a patch for the Minister of Public Works ; a patch, not very definite in colour, for the Postmaster General ; a patch equally undecided in colour for the Minister of Marine and Fisheries ; two patches perhaps-because he has two policies, one in the east.and one in the west-two patches for the Minister of Interior ; shreds and patches for the back benches ; with blue ruin all over it here and there by way of adornment for the Minister of Trade and Commerce, and with ornaments of immaculate white to represent the immaculate purity of the hon. leader of the government. The Conservative policy is not that kind of a policy. It is a policy which is well conceived, which is grounded on faith in the country, which is studded with hope throughout, a policy of certainty which has proved beneficent to this country in the past ; not devoid of colour either, for with the inauguration of this policy hope was brought to this country before ; and when the Conservative party comes to power again-and they cannot come too soon for the benefit of the country-a universal Christian emblem will span this country from ocean to ocean, and a rainbow of promise and hope will gladden the hearts of the people of Canada. Well, I do not Want to pay too much attention to the hon. member for Guysborough, because I would be enhancing his importance, and perhaps, he has enough of that now ; but he is as good a text to speak from as anybody else, and when I describe him I describe a good many others. The hon. member complained of the speech of the hon. member for North Nor* folk (Mr. Charlton) in this language :
I cannot conceive of the state of mind which would induce the hon. gentleman, who has done so much for the sanctity of the Sabbath and the
chastity of the home to make such a speech as he made in the House the other day.
Why cannot he conceive of it? I do not think my hon. friend from Guysborough does himself credit. Can he not understand an hon. gentleman repenting of his wickedness ? Is he at a loss to understand that the hon. member for North Norfolk, after having for eighteen or twenty years proclaimed a doctrine in which he did not believe, might very well be aroused by patriotism or by a desire to do what is fair by his country, to recede from the false position he had occupied, and come to acknowledge fairly and squarely that he had abandoned that life and had determined to lead a better one ? The hon member for Guysborough says:
' I cannot understand the state of mind which would induce the hon. gentleman.' Why, Mr. Speaker, does it require an inducement for a member of this House of Commons to do his duty ? What kind of inducement does the hon. member mean ? I do not know; perhaps he does. Then he says, speaking of the toon, member for North Norfolk, ' a gentleman who has done so much for the sanctity of the Sabbath and the chastity of the home.' God help this country, Mr. Speaker, when the sanctity of the Sabbath depends on hon. members of the Liberal party. They have robbed Providence of the credit of the good crops; they have robbed Providence of the rainfall and the gladdening sunshine, and now they are robbing Providence of the credit for the sanctity of the Sabbath. Why, these hon. gentlemen robbed us of our policy. We have heard of men taking coppers from dead men's eyes; but where will these gentlemen stop when they talk of some man sanctifying the Sabbath, the hon. member for North Norfolk by the mouth of the hon. member for Guysborough ? Then, he speaks of the man who has done so much for the chastity of the home. Well, if I read a line or two from a speech of the hon. member for Guysborough, you will see that the chastity of the home is something that the hon. member for North Norfolk might well give attention to. This is what the hon. member for Guysborough said at Morden in 1899 :
To such a Liberal who said that the government did not keep its pledges, he would say, look at home. Have you kept the pledges made to your wife before you married her ?
The hon. member for Guysborough is surprised; he cannot understand a state of things like that; and he says : ' Have you kept the pledges you made to your wife when you married her ? ' Hon. gentlemen I think generally do. Then he says :
But what would you think if your wife left you, and went off with another man, and that man an unsanctified tramp ? That woman would be just as vile as the Liberal who turned Tory. '
Now, I am not going to forget the reverence which I owe to the sacred name of woman

through all the discouragements through which they passed. At last the time came when the party got into power, and then this lover came and demanded the price of his faithfulness. But they said : No; we wish to serve our party by giving this portfolio to another ; you are getting old and are not exactly a suitable bridegroom. This was the shock which unnerved him, and which has clouded his memory ever since. He accepted the portfolio of Trade and Commerce, but always since then he has lived in the past. If the hon. gentleman thinks that that reference, is not suitable to his taste, then I will recommend him to consider a historic instance, that of Hans Christian Andersen, the great Dane who made himself illustrious as a writer of children's stories. Andersen had a great apprehension that he might be buried alive, and I think that the Minister of Trade and Commerce, perhaps, has reason to fear that, living in the past as he does, he also might be buried alive. To prevent the dreadful fate he feared, Andersen had pinned upon his clothing when he retired at night a paper bearing these words : ' I am not dead, I am only in a trance.' I trust the hon. Minister of Trade and Commerce may have an awakening sooner or later-and before it is too late. Talking of slumbering, I do not think that the hon. Minister of Trade and Commerce is really one whit more completely asleep than are a majority of the members of this government to the actual condition of things existing to-day. I can give no more apt illustration of what I think will be the historical verdict upon the attitude of the Reform party of to-day, and of the government in narticular, to the condition of the country, than is to be found in the well-known volume, ' Looking Backward.' You remember, Mr. Speaker, the instance, how a gentleman, returning to his house after being out for the evening, retired to a cell he had constructed for himself underground in order to be away from the disturbances of the house and the street. He had been celebrating ' Declaration Day '-this was in the city of Boston, in the United States. That night the building above was destroyed and communication with the cell was cut off. The rest of the story will be sufficiently described in what I read ;
And now (says the Dr.) ' can you tell me a little more explicitly when it was that you fell into that sleep, the date, I mean.' 1 Why, last night, of course ; I said so, did'nt I ? that is unless I have overslept an entire day. Great heavens ! that cannot be possible ; and yet I have an odd sensation of having slept a long time. It was was Decoration Day that I went to sleep.'	[DOT]
' Decoration Day ? '
Yes, Monday, the 30th.' 'Pardon me, the 30th of what ? '
Why, of this month of course, unless I have slept into June, but that cannot he.'
This is the month of September.'
' September ! You don't mean that I have slept since May ! God in heaven ! Why it is incredible.'
We shall see,' replied my companion ; * you say it was May 30 when you went to sleep ? '
' Yes.'
' May I ask what year ? '
I stared blankly at him, incapable of speech, for some moments.
' Of what year ? ' I feebly echoed at last.
' Yes, of what year, if you please ? After you have told me that I shall be able to tell you how long you have slept.'
' It was the year 1887,' I said.
My companion insisted that I should take another draft from the glass, and felt my pulse. He said :
' Your appearance is that of a young man of barely 30, and your bodily condition seems not greatly different from that of one just roused from a somewhat too long and profound sleep, and yet this is the 10th of September, in the year 2000, and you have slept exactly one hundred and 13 years, three months and eleven days.'
Now, I do not quote this for the amusement of the House, I quote it because it points a moral, and because we are at a crisies in the affairs of Canada. As the Minister of Trade and Commerce has been writing epitaphs in order to denounce the Conservative party, perhaps it might not be improper for me to sketch an epitaph for the hon. minister himself. I regret that if the people of Canada were to erect a monument to the Minister of Trade and Commerce, they could not, I fear, unless he repents, consistently engrave upon his monument any such legend as that which is engraved on the monument to the memory of the late Alexander Mackenzie :
' Duty was his law, conscience was his ruler.' But on second thought, I do not think it would be well to erect a monument to the hon. minister, I think it would be better that a tablet to his memory should decorate the halls of this chamber, in order that it might be a warning to young Liberals in future to be careful as to whom they accept as their guide. So I venture to suggest that a tablet be erected to the memory of the Minister of Trade and Commerce, to be placed on the southern wall of this chamber. What can we engrave upon it with any due regard to consistency ? We will, I think engrave two pillars of stone.- We will make one grand and graceful column dedicated ' Protection.' We will also have a crumbling rock inscribed with 'Free Trade,' and on that we will place the figure of the hon. Minister of Trade and Commerce, leaning against the pillar designated protection. We will place in his hand a flag and on it the legends unrestricted reciprocity, commercial union, political union, annexation to the United States, and absorption in the United States. We will have the hon. gentleman, as aforetime, looking to Washington, and near him the figure of a man, not in particularly good humour-a figure representative of a gentleman named Cook,-and this figure pointing menacingly to the Minister of

",Conservative (1867-1942),,Haughton Lennox,http://www.parl.gc.ca/parlinfo/Files/Parliamentarian.aspx?Item=5bfd2fe5-bfe6-42c4-9503-71c3b6f865df&Language=E&Section=ALL
