basepk,hid,speechdate,pid,opid,speakeroldname,speakerposition,maintopic,subtopic,subsubtopic,speechtext,speakerparty,speakerriding,speakername,speakerurl
36659,ca.proc.d.1902-04-18.1.5.22,1902-04-18,21e66c9f-80d0-4275-bfd5-c4c5d918080a,ca.m.2472,Mr. SCOTT.,,SUPPLY-THE EXPORT OF NICKEL.,CONSIDERED IN' COMMITTEE-THIRD READINGS.,,"I think I can assure the Minister of the Interior that if he grants the needed assistance, I shall be able to find a person who will take the position, notwithstanding the great prosperity that exists. This letter goes on :
The agent tells me that during the first week of April over one hundred homestead entries were made at the office here. The rush of Americans in over the Soo line has assumed tremendous proportions, the railway company being unable to handle the traffic. It takes about a week for a car of settlers' effects to come from St. Paul to Moosejaw. There are not half a dozen homesteads between Regina and the Soo line, the only part of the south plain where there are any homesteads being 'along the Areola extension and I don't think that there will be any there in three months.
As 1 say, nearly every letter one receives from the North-west Territories and nearly every paper that comes to hand, is tilled with intelligence about hundreds of newcomers who are arriving daily in that country. The Winnipeg ' Free Press,' which came to hand to-night, states that on Wednesday of this week no less than 1,000 settlers arrived in Winnipeg, and a very considerable proportion of all the settlers who arrive at Winnipeg go to some point in the North-west Territories. This is a very encouraging feature of the times, and I thoroughly agree with what was said by my hon. friend the Minister of the Interior last night, that we appear to be at the dawn of a new day. The present prospect is more encouraging than it has been at any time at least in my lifetime, and I think the committee will agree that it would be too bad if any check were given to the tendency of the people towards that country, by parsimony on the part of this House in dealing with the local needs of the people. As has often been said, any effort that may be put forth by this government to promote immigration must be secondary in effect to the work which will be done by satisfied settlers in the country, who, as is often said, are the best immigration agents. For my part, I think one of the most important duties coming within the purview of the Department of the Interior with regard to immigration is to see that the local needs, in the way of public works, education, and other things, are properly and adequately met. For these reasons, for my part-and I believe I speak for every member from the North-west Territories, and I believe as well that our friends from British Columbia and Manitoba will support us unanimously in this-I think the House should very largely increase the grant to the local government of the North-west Territories.

",Liberal,,Thomas Walter Scott,http://www.parl.gc.ca/parlinfo/Files/Parliamentarian.aspx?Item=21e66c9f-80d0-4275-bfd5-c4c5d918080a&Language=E&Section=ALL
36660,ca.proc.d.1902-04-18.1.5.23,1902-04-18,6e8d69a0-c443-4d32-9982-364df1473067,ca.m.2836,Mr. OLIVER.,,SUPPLY-THE EXPORT OF NICKEL.,CONSIDERED IN' COMMITTEE-THIRD READINGS.,,"I wish to support what has been said by the hon. member for Western Assiniboia (Mr. Scott) with regard to this vote for the government in the

",Liberal,,Frank Oliver,http://www.parl.gc.ca/parlinfo/Files/Parliamentarian.aspx?Item=6e8d69a0-c443-4d32-9982-364df1473067&Language=E&Section=ALL
36661,ca.proc.d.1902-04-18.1.5.24,1902-04-18,21e66c9f-80d0-4275-bfd5-c4c5d918080a,ca.m.2472,Mr. SCOTT.,,SUPPLY-THE EXPORT OF NICKEL.,CONSIDERED IN' COMMITTEE-THIRD READINGS.,,"North-west Territories. It was with some considerable surprise that I saw in the estimates that the amount to be voted for this purpose for the coming year was no larger than the vote for the present year. 1 am at a loss to understand upon what basis of calculation this sum was arrived at. If it is necessary or desirable to meet the requirements of the public service in any part of the country, account must be taken of the increase of those requirements. Now, this whole country is ringing with a knowledge of the increase of population and therefore increase of requirements in the North-west, and that knowledge has produced no result in the way of meeting the requirements which necessarily arise. It may be said that the amount required for the purposes of the government of the North-west Territories is an uncertain amount. So it is. It is an amount which depends from time to time upon the requirements as they arise. With the increase of population, those requirements have increased' from year to year. By reason of climatic conditions during the past year, those needs have been tremendously emphasized. By reason of heavy rains, bridges have been washed out by the dozen, and a very large part of the revenues of the territorial government which should have gone to extend the facilities of travel throughout new settlements in the country, has been used up in replacing the damage done by the floods in older settlements. It may not be altogether plain to members of the House why an increase of population means an increase of requirements. The reason is that the territories have immense areas, compared to population. They are not at all on the same footing as the province of Manitoba, where the population is contained in less than one-third of the total area of the province, and the total area of Manitoba is not over one-fourth of the area over which settlement is scattered in the North-west. An increase of settlement in the province of Manitoba means simply a thickening up of the population, - and does not require the opening of new roads or the establishment of new school districts, and does not increase materially the expenses of government; while an increase of population in the Northwest Territories means that people have spread out into new country, necessitating new roads and new schools and an increase in every way and materially of expenses of government. It is of course under our present condition a matter of arrangement or consideration of this parliament what shall be done from year to year to meet financial conditions. That is not the fault of the people or the government of the North-west Territories. The government of the North-west Territories has approached this government repeatedly during past years, and most formally during the past year, asking for a definite financial arrangement based on the terms of confederation, as applied to the different provinces of the

Dominion. They are not here from time to time clamouring for unknown and unheard of amounts. They are asking simply that the government or parliament either meet the requirements of the case, as they arise from time to time, or else put the territories in the same financial position as the various provinces of the Dominion, so that they may enjoy as a right what they now must ask as a favour. I submit that the position is this :	This parliament and government
are required either to meet the conditions that exist by an adequate vote, or else to put the territories in the position of the various provinces of the Dominion as regards financial arrangements. Either one thing or the other, and the responsibility is upon the House and the government in the matter.
As to the amount that is demanded and the comparisons that may be made with regard to that amount, the vote for carrying on the government of the North-west Territories, which stands in the same position as a subsidy voted to one of the provinces- out of which provision must be made for the construction of public works of all classes throughout the Territories, chiefly roads and bridges, the requirements of education. and the administration of all the departments of government-amounts to only $208,0U0. That is the total amount provided for all the expenses of government of the Territories, which are, in the existing circumstances, necessarily higher proportionately than in any other portion of the Dominion. And it is to cost the country $445,000 in the coming year for the expenses to be incurred ir. endeavouring to bring people into the North-west. I claim, Mr. Chairman, that these two expenditures are not proportionate. I claim that if $445,000 be a reasonable expenditure to bring people into the country, $358,000 is not a reasonable sum with which to provide for all the needs of local government, both for the people wild are in the country now, and those who are to come in as the result of this expenditure on immigration work.
I need not add to what my hon. friend from West Assiniboia (Mr. Scott) has said with regard to the effect that an inadequate provision for the needs of education, the opening of roads and the general matters of local government, must necessarily have on immigration into that country. The class of people who are going there in largest numbers are those whose first demand is for the facilities of schools and markets. They are an enterprising and an energetic people, who have built up the great country to the south of us, and who come over the line to build up a great country on our side. They will not be satisfied, unless they can have facilities for the education of their children and the ordinary advantages of civilization in due measure, as the circumstances permit. And now when those people are coming in large numbers, attracted by the desirability of our country, 97
it would be the worst policy that ever was entered upon, to stint the means whereby they may be rendered satisfied with the country. Do not forget that we had a rush of immigrants to the North-west many years ago, and at that time people seemed to think that the rush could not be stopped, but it was stopped and it remained stopped for nearly twenty years. There is a rush on again, and I counsel members of this House to take such measures that it shall not be stopped until that country has been satisfactorily developed. Every one knows that the best immigration agent is the contented settler. Therefore, our best policy is to provide adequate means to give intending settlers those advantages of civilization, which they will demand, and which they consider of the very highest importance. It is because these people look for these advantages of civilization and prize them so highly that they are valuable settlers. It is because they want schools and roads and good government that they are good settlers. People who would not make those demands, to whom it makes no difference whether or not there are schools or roads or good local government, are not the kind of people we want at all. They are dear at any price, and it is the best thing that ever happened this country that the people who are coming in and filling it up now are imbued with those civilizing tendencies.
I hope that the present government will see that the public services of the Northwest Territories are not starved at this critical stage in our history. I hope they will provide for those services according to the requirements, or else place the territories upon a provincial footing, so that there shall be no question about our rights in the matter.

",Liberal,,Thomas Walter Scott,http://www.parl.gc.ca/parlinfo/Files/Parliamentarian.aspx?Item=21e66c9f-80d0-4275-bfd5-c4c5d918080a&Language=E&Section=ALL
36662,ca.proc.d.1902-04-18.1.5.25,1902-04-18,dc6ece6e-a70f-44a4-9b2d-0c15d6600f23,ca.m.4392,Mr. DOUGLAS.,,SUPPLY-THE EXPORT OF NICKEL.,CONSIDERED IN' COMMITTEE-THIRD READINGS.,,"I only wish to make a few remarks in addition to what has already been said on this question. I would like to emphasize, if possible, in the mind of the committee, the statements that have been made by my hon. friend from West Assiniboia (Mr. Scott) and my hon. friend from Alberta (Mr. Oliver). This question of an increased subsidy is a very important one in the estimation of the people generally. We should have either an increased subsidy or provincial autonomy. As far as I have given the matter attention, I think it would be much better for the country, in its existing circumstances, to receive an increased subsidy at present rather than provincial autonomy. I know that there is a tendency amongst many members of this House to say that we, the people in the west, are always clamouring for special advantages. They point to the early settlers of the older provinces in the east and tell us that we are looking to be spoonfed and ought to have the courage, endurance and hardihood of the early settler in Ontario and elsewhere. Let me say that the



people in tlie North-west, especially those who went in twenty years ago, have passed through experiences of hardship and endurance, which show that they really possess, in a large measure, those qualities of resistance, and patience, and have indicated by their persistent effort that they believe in the country and are willing to endure privation in order to make it prosperous. I do not think that the early settlers of Manitoba and the North-west are, in any sense, behind those of the eastern provinces. 1 can speak from experience, having lived in that country from 1883 to date. I know something about the hardships of the people in the early days_of that country.
In reference to public works, it is quite evident that the sum at the disposal of the government of the North-west Territories is wholly inadequate. I can speak with special knowledge of that part of the country that I represent, the eastern part of Assiniboia. Take, for instance, the district lying north and south of the Qu'Appelle river. It is true, we have some steel bridges that are a credit to the territorial government that erected them. But even they are of little use in the spring season. I venture to say that to-day the great majority of the people living on the north side of the river are not able to cross the valley or approach the bridges to reach the market with a load of grain. That is a hardship. They have grain on their hands that they are anxious to get rid of and to settle then-liabilities. But this they cannot do because the approaches to these bridges are in a state that altogether forbids their reaching the markets. Perhaps they will not be able to reach the markets till the end of May or the beginning of June. We have a local organization for the improvement of the roads, and this has been a step in the right direction. I! think the system is even superior in point of organization to the municipal arrangements of the older provinces. The local improvement districts of the North-west Territories are doing good work and proving that the scheme will be a great success. Up to the last three or four years it has been largely in the hands of the settlers to help themselves in making roads to reach their markets, to call upon their neighbour, and they collect a number of individual! who voluntarily gave their work to make the road. But the government has organized the local improvement districts which entails a direct tax upon each quarter section for the improvement of the roads. And that certainly, as I have said, is a step in the right direction. But I have always felt that the sum that was given for the government of the North-west Territories was entirely inadequate. It is quite true that we have a claim upon the treasury of this Dominion, in common with the other provinces to a certain amount per head according to population. But it seems to me, in view of the rapid growth of immigration and of the population of that Mr. DOUGLAS.
country that the future ought to be discounted by the present government and a very liberal allowance made for the increase, to enable the territorial government to make the provisions which the circumstances at present demand. The fact that we are spending more upon immigration than upon the government of that country is one argument for the increase of indemnity. There is another fact that I would like to point out to the committee. It may not be popular, perhaps, for me to call attention to it. We would not say that this Dominion is paying too much for the wards of the country and for our Indian population. I would not for a moment insinuate that the government is paying too much for the Indian youth of the North-west Territories. But it is a fact-I am not prepared to give the exact figures on the instant, but what I say can be verified- that we are spending more upon the Indian industrial schools of the North-west than for the whole government of those territories. Now, I would like to emphasize what has already been said that under existing circumstances something ought to be done and a very liberal addition ought to be made to the subsidy of the North-west Territories, and that at the present session.

",Liberal,,James Moffat Douglas,http://www.parl.gc.ca/parlinfo/Files/Parliamentarian.aspx?Item=dc6ece6e-a70f-44a4-9b2d-0c15d6600f23&Language=E&Section=ALL
36663,ca.proc.d.1902-04-18.1.5.26,1902-04-18,4e5c3384-96e9-423c-a20f-f9483ccd5ed4,ca.m.3673,Mr. MCCREARY.,,SUPPLY-THE EXPORT OF NICKEL.,CONSIDERED IN' COMMITTEE-THIRD READINGS.,,"' I desire to say a very few words on this subject, first, because this affects the prairie country, and I would like to endorse the sentiments of my colleagues, and, second, because this is one of the most important questions that is to come before this House in the near future- the subsidy of the territories, or provincial autonomy therefor. I have been reading what has taken place in the House in Regina with regard to territorial autonomy and I must say that I was struck with the force of the arguments. But my own impression is that, at the present time, there are good arguments why provincial autonomy should not to be given to the territories. I believe that within the next three or four years, if immigration should continue as at present, the population of the territories will have so increased and so tended to certain portions of the territories that probably the local jealousies that now exist as to whether there should be one or two or three provinces, and where the capitals shall be, will have disappeared. I sometimes think also that they have not considered the expenditure that would devolve upon them if they had to govern themselves. Take, for instance, the mounted police. I am not sure, but I suppose the number of police in the territories must reach from five hundred to a thousand. If the duty of policing the country devolved upon the local government, what a large percentage of the subsidy got from this government it would take.
I believe the older provinces of Canada have not looked upon this matter in the proper light. Some hon. gentleman here said-

I think it was the hon. member for Alberta (Mr. Oliver)-that it is one thing to bring immigrants to the country and another to keep them here. I was one of the unfortunates who left this eastern part of Canada twenty-two years ago last month. 1 arrived in Winnipeg some time in March, got my ox and cart and started across the prairies with others. I shall never forget as long as I live some of the hardships l saw the settlers undergo. We met violent storms at Portage la Prairie, and further west where Brandon now is, and also about the locality of Rapid City. There were no towns there then. I have seen strong men shed tears when they saw their wives and children In water three or four feet deep trying to cross the creeks and ravines where there were no bridges. A large number of people left the country as soon as they could get out of it. I believe 85 per cent Of those who came from the British islands in 1882 and 1883 left that country before 1885. In the first place, they could not get to a market or to a railway centre. They saw no sign of civilization. They had no company and they got lonely. There were no post offices, they could not get a letter or Send one without going fifty or sixty miles. They had no schools, and their children were growing up in ignorance around them. That same condition exists in the territories and it will have the same effect if this government do not wake up to the facts. I know a family; I could give their names- I will give their names. Mr. Richard Lyons and his family, who settled in Manitoba, thirty-five miles from Swan River, in 1898. Mr. Lyons had eleven of a family and came from the north of Ireland. Although we have provincial government there, he remained there for fifteen months before he had a school or post office nearer than Swan River thirty-fire miles away. He wrote me letters, aiyl in one of them he said : 1 will leave this country in three months, unless I can get a school or post office. I wrote to the superintendent of immigration and finally succeeded in meeting his wishes. That is one example of the kind of thing that may happen in the territories.
Now, Mr. Chairman, when you think of 8357,000, with, I think 840,000 the hon. gentleman said of local revenue, say $400,000 altogether, to supply all the municipal and other services required in that vast territory, I think any man who has had experience in municipal matters must wonder how it has been done. Most of you who live in cities and towns in Ontario probably know the condition here in Ottawa, as I know the condition in the city of Winnipeg. The revenue of the city of Winnipeg is some $635,000, of which $135,000 is paid yearly for schools. The revenue of the city of Winnipeg, a town of 50,000 inhabitants, is nearly double the sum with which they have to govern that whole territory 500 miles by 400 miles. I ask if that is fair. I say it is great credit to the 97i
Hon. Mr. Haultain and his colleagues that they have been able to administer the affairs of that government as economically as they have done during the last ten years. I do not believe there is a province in Canada where the same amount of money has yielded so much benefit to the people as has the money spent by the territorial government.
Hon. gentlemen from the east may think this is pecularily a western question. Now it is not, it is more an eastern matter. A great many gentlemen on the other side of the House live in cities and towns which are manufacturing centres. For instance, we have three members from Toronto, none of them here to-night. I would ask those gentlemen in the city of Toronto who understand the Massey-Harris people, what a good settler is worth to the Massey-Harris people every year. I ask them what every new family who goes into the territories is worth to the manufacturers of eastern Canada. They are worth nothing to western Canada in that way, we have no manufacturers, we have no implements, no cloth, woollens nor cottons, no fruits-everything these people have to buy must come from the east. Every settler you put there increases the wages of your artisans, increases the population of your cities and towns in Ontario. It does not help us half as much as it helps you people here, and I think it is your duty to wake up to the fact that the more settlers you get in there the larger your towns will grow, and the higher the value of your lands will become in older Canada. I say this is a matter of gigantic importance. I believe that in the supplementary estimates to be brought down this session a very large sum of money should be granted in aid of the people of the territories. Bear in mind also that while the population that is going in there now very largely comes from the United States, Europe and Great Britain, a considerable percentage, in fact I should imagine 30 or 40 per cent, are your own brothers, and sisters, and sons from the eastern provinces. Are you going to allow them to endure the hardships that your forefathers had to endure here in the Ottawa district, and other districts of eastern Canada ? I say times have changed, and those people should have enough money to support their schools, to build their bridges, and to make the necessary improvements to keep pace with the advancing population. I may remark to the Postmaster General, as I remarked the other day to his deputy, that he should not expect to get, in a new country like that, sufficient revenue to run the post offices. In Ontario where your farmers are settled on 50 to 100 acres of land, it is quite easy to have a post office where there is no settler further than three miles from the post office; but out there where the settler has got to occupy 320 acres of land to make it pay, you cannot expect, at least for some

",Liberal,,William Forsythe McCreary,http://www.parl.gc.ca/parlinfo/Files/Parliamentarian.aspx?Item=4e5c3384-96e9-423c-a20f-f9483ccd5ed4&Language=E&Section=ALL
36664,ca.proc.d.1902-04-18.1.6,1902-04-18,,,,subtopic,SUPPLY-THE EXPORT OF NICKEL.,COMMD.NS 30S0,,,,,,
36665,ca.proc.d.1902-04-18.1.6.1.1,1902-04-18,,,,stagedirection,,,,"time, that the post offices are going to pay. You have got to charge up any deficiency in your postal department to some other appropriation. you can charge it to immigration if you like. But I say post offices ought to be given to the people out there without any regard to whether there is sufficient revenue to make them pay. I think that in the subsidies to be brought down at a subsequent period of the session, there should be a sum of at least $200,000 or $250,000 to supplement the grants already made to provide for running the territories.",,,,
