basepk,hid,speechdate,pid,opid,speakeroldname,speakerposition,maintopic,subtopic,subsubtopic,speechtext,speakerparty,speakerriding,speakername,speakerurl
36447,ca.proc.d.1902-04-18.1,1902-04-18,,,,topic,SUPPLY-THE EXPORT OF NICKEL.,,,,,,,
36448,ca.proc.d.1902-04-18.1.1.1,1902-04-18,,,,stagedirection,,,,The MINISTER OF FINANCE moved that the House go into Committee of Supply-,,,,
36449,ca.proc.d.1902-04-18.1.2,1902-04-18,,,,subtopic,SUPPLY-THE EXPORT OF NICKEL.,,,"['I think we might very well now adjourn. In any case there is no quorum, and considerable business has been done.\nSome resolutions reported.\nOn motion of the Minister of Finance House adjourned at 12.20 a.m. Saturday.', 'Monday, April 21, 1902.']",,,,
36450,ca.proc.d.1902-04-18.1.2.1,1902-04-18,03119541-a274-44e2-ab4a-6d6f6b3c6d5a,ca.m.2710,Mr. JOHN CHARLTON (North Norfolk).,,SUPPLY-THE EXPORT OF NICKEL.,,,"Before you leave the Chair, I desire to refer briefly to a matter of some importance to the country. I shall do so without making any motion in reference to the subject. I refer to the export of nickel from Canada.

This country, for fifteen years, has been the chief source of supply of nickel for the world. The business has been managed by our American friends in such a way that they have derived nearly all the advantages that could be obtained from the extensive and lucrative business of refining nickel and converting it into finished products. The American policy as regards the nickel industry is to admit the matte or refined ore free of duty, and to impose a very heavy duty upon the refined nickel, that duty amounting to $120 pel. ton. The result has been that our nickel deposits have been worked by the companies owning the mines in Canada, and the matte has been exported to the United States and refined there, giving to that country a very lucrative business. But the policy we have permitted the United States to pursue towards us in this matter is one that certainly has not been conducive to our own interests. The use of nickel promises to be increased, and therefore the control of the industry will be one of much greater importance in the near future than it has been up to the present. The manufacture of nickeliferous-pig iron will play a very important part in the manufacturing operations in connection with nickel in the very near future. Nickel is not only essential in the manufacture of armour plate, but it can be used to great advantage in material for bridges, in material for buiiu-ing, in fact for material for structural purposes generally ; and the control of the business will be a matter of great importance to whatever country obtains it. The United States capitalists and business men are quite wide awake to the advantages to be derived from the control of this business, and, within a few days a great nickel company has been formed in the United States entitled the International Nickel Company which is operating in connection with, and is largely controlled by the American Steel Corporation, commonly known as the Steel Trust. This new company I see by the ' Engineering and Mining Journal ' of April 5, was incorporated in the week of that issue of the ' Journal.' I will read one or two paragraphs from the article on this subject:
The International Nickel Company, which was organized this week in1 New Jersey, is the resuit of the plans to consolidate and control the nickel production of the world, to which reference has been made in1 our columns1 heretofore. The plan was originated by Colonel R. M. Thompson, president of the Orford Copper Company, and has been carried through chiefly by his efforts, that he has had recently the aid of Mr. Schwab, of the United States Steel Corporation and Colonel J. R. De Le Mar.
The purchase of the stock of the Nickel Corporation, Limited, from its London owners was one of the steps towards the present consolidation. The case of that company, which owns valuable concessions in New Caledonia, has already been dismissed in the 'Journal.'

",Liberal,,John Charlton,http://www.parl.gc.ca/parlinfo/Files/Parliamentarian.aspx?Item=03119541-a274-44e2-ab4a-6d6f6b3c6d5a&Language=E&Section=ALL
36451,ca.proc.d.1902-04-18.1.2.2,1902-04-18,03119541-a274-44e2-ab4a-6d6f6b3c6d5a,ca.m.2710,Mr. CHARLTON.,,SUPPLY-THE EXPORT OF NICKEL.,,,"The International Nickel Company will issue $12,000,000 in common stock; $12,000.000 in preferred stock, carrying six per cent dividends, non-cumulative, and $10,000,000 in1 five per cent bonds haying 30 years to run. Of the authorized capital stock $9,000,000 common and $9,000,000 preferred will he issued at once to acquire the properties named below. The remaining stock will he reserved for future use. . . .
The properties in which the new company will own1 a controlling interest-if not, the whole-are those of the Canadian Copper Company in Canada and the United States ; the Orford Copper Company, with extensive reduction works at Bayonne, N.J. ; the Anglo-American Iron Company and the Vermillion Manufacturing Company in Canada ; the American Nickel Works of Joseph Wharton in Camden, N.J.; the Nickel Corpors.tion, Limited, and the Societe Miniere Caledonienne in New Caledonia.
The Societe Le Nickel, with its extensive properties in New Caledonia and its reduction works In France, is not included in the combination. It is intimated, however, that the International Nickel Company has already a full underslaiding with the French Company. It is believed that a community-of-interest plan has been arranged which will regulate production, prices and a division of the markets.
Now, Mr. Speaker, we see here not a proposed but an actual formation of a great nickel trust, with a capital of $24,000,000, with bonds of $12,000,000, associated with the Steel Trust of the United States with a capital of $1,000,000,000, the avowed purpose of which is to acquire the nickel properties and control the nickel business of tbe world. Now the question is whether Canada is advancing its own interests in promoting the continuance of the policy which has hitherto prevailed with regard to the nickel industry. The question is whether it is in the interest of Canada to promote the exportation of nickel in its lowest prepared form, that is, in concentrated ore, to be refined in the United States, and to submit to the policy of the United States which imposes an enormous import duty upon refined nickel and admits the matte free. The result of this policy has been that we have never refined a ton of nickel in Canada. This great company has purchased the Copper Cliff property for $4,375,000, payable in stock partly, and partly in cash ; it has purchased other properties in Canada on conditions of a similar character.
The significance of the launching of this scheme, the significance of the formation of tliis trust, the fact that a great nickel iron company, in concert with the great Steel Trust of the United States, has been formed, is one which I think the government of the day is called upon to take into careful consideration. We have an interest in this matter, England has an interest in this matter. If the plans of this great international nickel corporation can be consummated and carried into effect, it will liave a very serious influence upon England's interest in the matter of acquiring armour plate ; it will liave a very serious influence upon England's interest and upon our own in the

matter of nickeliferous pig iron and the manufacture of .nickel steel for the various purposes that that metal is adapted to. Our interest in this matter, the interest of England in this matter, the scope and character of this combination or corporation, are matters to which, in my opinion, we are called to give careful consideration. I do not see, Mr. Speaker, why it is not possible to refine the nickel that is mined in our own country;
I do not see why, with the adoption of a proper policy, Canada cannot only control practically the nickel supply of ore, but also the nickel supply of the refined article. The government has in its own hands power to deal with this question, and it is unnecessary to introduce legislation. We have in the statutes, 60 and 61 Victoria, chapter 17, powers given with reference to the imposition of export duties which will enable the government, by a simple Order in Council, to meet the policy of the Americans by the imposition of an export duty upon nickel matte that will give us a chance to secure at least our share of the business of refining this metal in Canada.
In connection with tin's matter, while I am on my feet, there is another one which I wish to refer to, another case in which our respected and highly esteemed Uncle Samuel is a little too smart for us. When the United States acquired the Philippine Islands. I believe there was an explicit understanding or agreement with the English government that the policy of the United States with reference to the Philippines should not discriminate against other countries. I see that this matter lias been made, the day before yesterday, the subject of a parliamentary inquiry in the British House of Commons. Now, Sir, there was, during the Spanish occupancy of the Philippines, an export duty levied upon manilla of $7.50 a ton, or 37 cents per hundred weight. The imposition of this export duty has been continued by the Philippine government, and the tariff which embodies this provision among its other provisions, has received the sanction of the United States government. Manilla, under this tariff, pays this export duty of $7.50 per ton, and when it is imported into the United States, that export duty is remitted, and this provision places the American manufacturer of cordage in a position where he has the advantage over the manufacturers of cordage in other countries ; it is practically giving him a bonus of $7.50 per ton upon the cost of his raw material. Now the United States government are debarred by constitutional limitations from the imposition of an export duty, but they have taken a course which enables them to avail themselves of this export duty levied in the Philippine Islands as efficiently and completely as if it were levied by the United States government The Canadian importer of manilla cannot go to the United States and purchase manilla without having it subject to the export duty, he has got to pay an export duty, whether he buys manilla in
the Philippine Islands and imports it direct, or whether he buys it in the United States of the American importer ; and paying this export duty he is placed at a disadvantage with his American competitor in the sale of cordage in our own market.
Then with reference to manilla binder twine, this is admitted free. Now the Canadian producer of binder twine cannot compete with the American producer, because the American producer has the advantage at the outset of $7.50 per ton in the cost of the raw article. It has been supposed that there is reciprocity between the two countries in the exportation and importation of binder twine ; but an examination of the American tariff will show that the binder twine we can export to the United States free of duty must not contain manilla fibre, and if it does contain manilla fibre, then it goes under the head of unenumerated articles and pays 20 per cent. Now this is the condition in respect to this article, where we are placed at an unfair disadvantage. The imposition of export duties which are made to serve the purpose of the United States manufacturer by reducing the cost of his raw material to the extent of the export duty as compared with the cost of the raw material to all other countries, is a matter which, in my opinion, requires the attention of the government ; and this thing can only be met by countervailing duties. If we were to impose a specific duty of half a cent a pound upon cordage and upon binder twine, then we would equalize the conditions. and put our manufacturer upon the same footing with the American manufacturer. But unless we do this, the American manufacturer has the Canadian manufacturer at a disadvantage, and I hold. Mr. Speaker, that it is the duty of the government so far as it is able to do this, to protect our own interests. I place those facts with regard to these industries ; with regard to the nickel industries and with x-egard to the manufacturer of cordage and twine before the government for its consideration.
The MINISTER OP FINANCE (Hon. W. S. Fielding.) The hon. gentleman (Mr. Charlton) has called attention to two matters of importance, both of which have somewhat engaged the attention of the government. With regard to the export of nickel, the House is aware that several years ago the government took power in the Customs Act to levy export duties on nickel, but after very full consideration of the question it was not deemed to be in the best interests of the mineral development of Canada that these export duties should at the time be imposed. The hou. gentleman (Mr. Charlton) represents that some new conditions have arisen through the creation of a great monopoly in the nickel industry, and so far as that presents any new aspect of the case the government would be bound of course to give it due consideration and will do so.

The other question to which my hon. friend has referred was brought before us recently both through notice in the public press and through representations made during the past few days by gentlemen interested in the business affected. It is a very curious condition of affairs ; I think unlike anything in connection with our tariff matters which has ever been presented to the House before.

",Liberal,,John Charlton,http://www.parl.gc.ca/parlinfo/Files/Parliamentarian.aspx?Item=03119541-a274-44e2-ab4a-6d6f6b3c6d5a&Language=E&Section=ALL
36452,ca.proc.d.1902-04-18.1.2.3,1902-04-18,03119541-a274-44e2-ab4a-6d6f6b3c6d5a,ca.m.2710,Mr. CHARLTON.,,SUPPLY-THE EXPORT OF NICKEL.,,,"Hear, hear.

",Liberal,,John Charlton,http://www.parl.gc.ca/parlinfo/Files/Parliamentarian.aspx?Item=03119541-a274-44e2-ab4a-6d6f6b3c6d5a&Language=E&Section=ALL
36453,ca.proc.d.1902-04-18.1.2.4,1902-04-18,intervention,,,,SUPPLY-THE EXPORT OF NICKEL.,,,"All I can say for the present is, that the matter is engaging the attention of the government. Whether or not it is an evil which needs a remedy is a matter which will have to be determined at an early date, and I trust my hon. friend will not expect me to say more than that at the present stage.

",,,The MINISTER OF FINANCE.,
36454,ca.proc.d.1902-04-18.1.3,1902-04-18,,,,subtopic,SUPPLY-THE EXPORT OF NICKEL.,MANITOBA SCHOOL LAND SALES.,,,,,,
36455,ca.proc.d.1902-04-18.1.3.1,1902-04-18,afe7c34c-ce0c-4794-9c37-be97ecaea761,ca.m.7247,Mr. N. BOYD (Macdonald).,,SUPPLY-THE EXPORT OF NICKEL.,MANITOBA SCHOOL LAND SALES.,,"I wish to ask the Minister of the Interior if he will lay on the Table at an early date the report of the commission that was appointed to inquire into the irregularities in regard to school lands sales 7

",Conservative (1867-1942),,Nathaniel Boyd,http://www.parl.gc.ca/parlinfo/Files/Parliamentarian.aspx?Item=afe7c34c-ce0c-4794-9c37-be97ecaea761&Language=E&Section=ALL
36456,ca.proc.d.1902-04-18.1.3.2,1902-04-18,intervention,,,,SUPPLY-THE EXPORT OF NICKEL.,MANITOBA SCHOOL LAND SALES.,,"Was a return ordered by the House 7

",,,The MINISTER OF THE INTERIOR (Hon. Clifford Sifton).,
36457,ca.proc.d.1902-04-18.1.3.3,1902-04-18,afe7c34c-ce0c-4794-9c37-be97ecaea761,ca.m.7247,Mr. BOYD.,,SUPPLY-THE EXPORT OF NICKEL.,MANITOBA SCHOOL LAND SALES.,,"I do not think so.

",Conservative (1867-1942),,Nathaniel Boyd,http://www.parl.gc.ca/parlinfo/Files/Parliamentarian.aspx?Item=afe7c34c-ce0c-4794-9c37-be97ecaea761&Language=E&Section=ALL
36458,ca.proc.d.1902-04-18.1.3.4,1902-04-18,intervention,,,,SUPPLY-THE EXPORT OF NICKEL.,MANITOBA SCHOOL LAND SALES.,,"If the hon. gentieman desires, I will have it brought down.

",,,The MINISTER OF THE INTERIOR.,
36459,ca.proc.d.1902-04-18.1.3.5,1902-04-18,afe7c34c-ce0c-4794-9c37-be97ecaea761,ca.m.7247,Mr. BOYD.,,SUPPLY-THE EXPORT OF NICKEL.,MANITOBA SCHOOL LAND SALES.,,"I hope it will not take too long.

",Conservative (1867-1942),,Nathaniel Boyd,http://www.parl.gc.ca/parlinfo/Files/Parliamentarian.aspx?Item=afe7c34c-ce0c-4794-9c37-be97ecaea761&Language=E&Section=ALL
36460,ca.proc.d.1902-04-18.1.3.6.1,1902-04-18,,,,stagedirection,,,,"Motion agreed to, and House went into Committee of Supply.
Civil government : Department of Indian Affairs, including J. D. McLean at $2,400, notwithstanding anything in the Civil Service Act, $55,167.50.",,,,
36461,ca.proc.d.1902-04-18.1.3.7,1902-04-18,intervention,,,,SUPPLY-THE EXPORT OF NICKEL.,MANITOBA SCHOOL LAND SALES.,,"The net increase here is $4,097.50, of which $3,200 is for the appointment of a deputy superintendent general of Indian affairs. There are 33 statutory increases of $50 each ; one at $25, and one at $12.50 ; increase of the salary of the secretary, $100, making a total of $5,027.50. There is a reduction caused by the removal of a first-class clerk and the appointment of a second-class clerk in his place, leaving a saving of $400. There is the difference between a third-class clerk who got $1,000 and who has been superannuated owing to ill health, and a new junior second-class clerk at $000, giving a saving of $400. A clerk now deceased got $750, and the clerk appointed in his place gets $600, giving a saving of $150. This leaves a total saving of $950, which deducted from the gross increase of $5,027.50, leaves the net increase Hon. Mr. FIELDING.
$4,097.70. Respecting the appointment of a deputy superintendent general of Indian affairs ; we have not had for the last five years a separate officer occupying that position. The deputy minister of the Interior discharges the duties of the office. If the work of the Department of the Interior had remained in the condition in which it was when I took office it would be quite possible to go on without making this appointment ; but the increase in the work of the department has been so enormous that it is absolutely impossible for the deputy minister of the Interior to give all the attention to that work which it should receive. There are many important matters in the Indian Department which ought to receive that attention which it is impossible for myself or for Mr. Smart to give them, for the reason that they are matters which would necessarily take considerable time in considering to deal with properly. I refer more particularly to disputed questions between the Department of Indian Affairs and the various provinces. There is no department of the government which comes in conflict so often with the provinces as does the Indian Department. There are questions constantly arising with regard to land and minerals which require a great deal of attention, and I have not been able to give as much attention to these subjects as I would like. That is one reason why we feel that in the public interest we ought to have an officer who would be competent to give all his attention to the subject.
Mr.	SPROULE.	Who discharges theduties	of this office	now	7The	MINISTER	OF	THE	INTERIOR.
Mr. Smart, the deputy minister of the Interior.

",,,The MINISTER OF THE INTERIOR.,
36462,ca.proc.d.1902-04-18.1.3.8,1902-04-18,7b93f979-f291-49f1-9a5c-54d08800f177,ca.m.2348,Mr. SPROULE.,,SUPPLY-THE EXPORT OF NICKEL.,MANITOBA SCHOOL LAND SALES.,,"You abolished this office a few years ago, and you then claimed there was no need for it.
The	MINISTER	OF	THE	INTERIOR.
If the work had remained the same it would be quite possible to have carried on the work with one deputy. If the hon. gentleman looks at the returns of the Department of the Interior, he will see that the work of that department has multiplied three or four times during the last five years, and the correspondence alone has'increased three times at least. I am satisfied that the making of this appointment is absolutely in the public interest.

",Conservative (1867-1942),,Thomas Simpson Sproule,http://www.parl.gc.ca/parlinfo/Files/Parliamentarian.aspx?Item=7b93f979-f291-49f1-9a5c-54d08800f177&Language=E&Section=ALL
36463,ca.proc.d.1902-04-18.1.3.9,1902-04-18,7b93f979-f291-49f1-9a5c-54d08800f177,ca.m.2348,Mr. SPROULE.,,SUPPLY-THE EXPORT OF NICKEL.,MANITOBA SCHOOL LAND SALES.,,"Do I understand that the present occupant, Mr. Smart, is to be the deputy superintendent general of Indian Affairs, or is he the deputy minister of the Interior.

",Conservative (1867-1942),,Thomas Simpson Sproule,http://www.parl.gc.ca/parlinfo/Files/Parliamentarian.aspx?Item=7b93f979-f291-49f1-9a5c-54d08800f177&Language=E&Section=ALL
36464,ca.proc.d.1902-04-18.1.3.10,1902-04-18,intervention,,,,SUPPLY-THE EXPORT OF NICKEL.,MANITOBA SCHOOL LAND SALES.,,"He is both.

",,,The MINISTER OF THE INTERIOR.,
36465,ca.proc.d.1902-04-18.1.3.11,1902-04-18,7b93f979-f291-49f1-9a5c-54d08800f177,ca.m.2348,Mr. SPROULE.,,SUPPLY-THE EXPORT OF NICKEL.,MANITOBA SCHOOL LAND SALES.,,"The question I asked was : Who is to fill the office in future 7

",Conservative (1867-1942),,Thomas Simpson Sproule,http://www.parl.gc.ca/parlinfo/Files/Parliamentarian.aspx?Item=7b93f979-f291-49f1-9a5c-54d08800f177&Language=E&Section=ALL
36466,ca.proc.d.1902-04-18.1.3.12,1902-04-18,intervention,,,,SUPPLY-THE EXPORT OF NICKEL.,MANITOBA SCHOOL LAND SALES.,,"I cannot say that to the hon. gentleman because I have not come to a conclusion yet. No appointment can be made however until the salary is voted.

",,,The MINISTER OF THE INTERIOR.,
36467,ca.proc.d.1902-04-18.1.3.13,1902-04-18,7b93f979-f291-49f1-9a5c-54d08800f177,ca.m.2348,Mr. SPROULE.,,SUPPLY-THE EXPORT OF NICKEL.,MANITOBA SCHOOL LAND SALES.,,"This Is another illustration of the failure of hon. gentlemen to keep their promise that wonderful changes would be made when they came into office. They kept it for a short time until they got rid of the incumbent of the office, and thus made a vacancy, and in a little while they re-established the office for the purpose of putting in one of their own friends. It seems to me that this is one of the main objects in view at the present time.
Department of Indian Affairs-clerical and other assistance, $3,130.

",Conservative (1867-1942),,Thomas Simpson Sproule,http://www.parl.gc.ca/parlinfo/Files/Parliamentarian.aspx?Item=7b93f979-f291-49f1-9a5c-54d08800f177&Language=E&Section=ALL
36468,ca.proc.d.1902-04-18.1.3.14,1902-04-18,unmatched,,,,SUPPLY-THE EXPORT OF NICKEL.,MANITOBA SCHOOL LAND SALES.,,"There is an increase here.

",,,Mr.   SPIIOHLE@,
36469,ca.proc.d.1902-04-18.1.3.15,1902-04-18,intervention,,,,SUPPLY-THE EXPORT OF NICKEL.,MANITOBA SCHOOL LAND SALES.,,"There is an increase of $150 which is made up as follows :	There are five clerks who
are paid out of this vote and two messengers. The statutory increases to these clerks amount to $210. There is a saving effected by the difference between the salary of Miss Garfoote, who has resigned and who was receiving $460, and the salary of the clerk who has been appointed since in her place and who gets the minimum salary of $400, thereby effecting a saving of $60. Taking $60 from $210 makes a net increase of $150.
Ontario and Quebec-relief, medical attendance and1 medicine, Quebec, $5,600.

",,,The MINISTER OF THE INTERIOR.,
36470,ca.proc.d.1902-04-18.1.3.16,1902-04-18,7b93f979-f291-49f1-9a5c-54d08800f177,ca.m.2348,Mr. SPROULE.,,SUPPLY-THE EXPORT OF NICKEL.,MANITOBA SCHOOL LAND SALES.,,"I see there is an increase in the item of relief, medical attendance and medicine for Quebec of $2,000. Wliat is the explanation of that ?

",Conservative (1867-1942),,Thomas Simpson Sproule,http://www.parl.gc.ca/parlinfo/Files/Parliamentarian.aspx?Item=7b93f979-f291-49f1-9a5c-54d08800f177&Language=E&Section=ALL
36471,ca.proc.d.1902-04-18.1.3.17,1902-04-18,intervention,,,,SUPPLY-THE EXPORT OF NICKEL.,MANITOBA SCHOOL LAND SALES.,,"The total increase in these two amounts is $1,000, but there is in reality an increase of $2,900 in the item for relief, medical attendance and medicine in Quebec and Ontario, $2,000 in Quebec and $900 in Ontario, making $2,900. We have dropped the vote of $200 which has appeared in the estimates before to provide for the removal of Indians from Oka to the township of Gibson and we have dropped the vote of $1,700 for the repairs to the mission house at Caughnawaga. That makes $1,900 and it leaves a net increase of $1,000. I want to call the attention of the committee to the fact that in reality there is an increase of $2,900. It is for relief, medical attendance and medicine in Quebec and Ontario. As I have explained to the committee on various occasions the department of Indian Affairs has had very great difficulty in dealing with this question. They have endeavoured to keep the amount of expenditure down to the lowest possible figure,
but they have always had to come before the House and ask for a supplementary vote. The officials inform me that they have asked for this increased amount because they believe it will cover the expenditure for the year and that they will not then have to ask for a supplementary vote.

",,,The MINISTER OF THE INTERIOR.,
36472,ca.proc.d.1902-04-18.1.3.18,1902-04-18,7b93f979-f291-49f1-9a5c-54d08800f177,ca.m.2348,Mr. SPROULE.,,SUPPLY-THE EXPORT OF NICKEL.,MANITOBA SCHOOL LAND SALES.,,"But, your old item in your last estimates included the supplementary vote of last year ?

",Conservative (1867-1942),,Thomas Simpson Sproule,http://www.parl.gc.ca/parlinfo/Files/Parliamentarian.aspx?Item=7b93f979-f291-49f1-9a5c-54d08800f177&Language=E&Section=ALL
