basepk,hid,speechdate,pid,opid,speakeroldname,speakerposition,maintopic,subtopic,subsubtopic,speechtext,speakerparty,speakerriding,speakername,speakerurl
36348,ca.proc.d.1902-04-17.4.7.1.1,1902-04-17,,,,stagedirection,,,,"Names.	When Appointed.	Salary.	When Raised.	Present Salary.C. vV. Speers 	March, 1897....	S 1,500	Nov. 1,1898	s 2,000J. C. Crear . .	M. V. Mclnnes	Feb. 1,1897	
10,1897.... Dec. 1,1897...	1,500 1,200	July, 1901 ... Feb. 1,1900....	1,800 1.500 1,200 1,200 2,000 600 3,000 1,200 1,800 1.500James Grieve	W. H. Rogers	M. V. Bennett	.. 1,1901.... July 1,1901.... Sept., 1900.... Tuly 1,1900.... Sept., 1899...	W. J. White. .>",,,,
36349,ca.proc.d.1902-04-17.4.7.2,1902-04-17,unmatched,,,,SUPPLY-PREFERENTIAL TRADE WITHIN THE EMPIRE.,NAMES OF IMMIGRANT AGENTS WHOSE SALARIES WERE RAISED.,,,,,Rev.   M.@,
36350,ca.proc.d.1902-04-17.4.7.3,1902-04-17,4fa6e520-c225-437f-92e4-2fe6af783ace,ca.m.8941,Mr. WILSON.,,SUPPLY-PREFERENTIAL TRADE WITHIN THE EMPIRE.,NAMES OF IMMIGRANT AGENTS WHOSE SALARIES WERE RAISED.,,"migrants for that increased expenditure.

Now, Sir, I believe that these figures are correct, and if the Minister of the Interior will compare them carefully with the official documents in his department, he will find that they are correct. ,1 have other figures here but they are not altogether what I would consider complete. It appears that for a good share of the time they have not been keeping a very correct account of the number of immigrants that come in from the continent of Europe, but I will give the table if hon. gentlemen think it desirable.

",Conservative (1867-1942),,Uriah Wilson,http://www.parl.gc.ca/parlinfo/Files/Parliamentarian.aspx?Item=4fa6e520-c225-437f-92e4-2fe6af783ace&Language=E&Section=ALL
36351,ca.proc.d.1902-04-17.4.7.4,1902-04-17,intervention,,,,SUPPLY-PREFERENTIAL TRADE WITHIN THE EMPIRE.,NAMES OF IMMIGRANT AGENTS WHOSE SALARIES WERE RAISED.,,"Go on.

",,,Some hon. MEMBERS,
36352,ca.proc.d.1902-04-17.4.7.5,1902-04-17,4fa6e520-c225-437f-92e4-2fe6af783ace,ca.m.8941,Mr. WILSON.,,SUPPLY-PREFERENTIAL TRADE WITHIN THE EMPIRE.,NAMES OF IMMIGRANT AGENTS WHOSE SALARIES WERE RAISED.,,"I have here an account of the number of immigrant agents employed by the Dominion government each year on the continent of Europe, their salaries and expenses from the 1st of July, 1891 to the 30th of June, 1901 :
Number of immigrant agents employed by the Dominion government each year on the continent of Europe, their salaries and expenses from July 1, 1891, to June 30, 1901.
Y ear.	Number of Agents.	* Salaries.	Printing and other Expenses.	Total.$ cts.	8 cts.	$ cts.1801-2	3	686 51	24S 00	934 001892-3	2	825 00	620 80	1,445 801893 4	5	2,684 97	4,175 20	6,860 001894-5....	i	1,200 00	519 05	1,719 001895-6	i	1,200 00	600 00	1,800 001896-7	3	1,976 94	963 45	2,940 001897-8....	0	8,373 00	2,230 59	10,603 001898-9... .	7	6,20!) 41	2.449 81	8,659 001899-1901)..	4	4,239 69	2,463 05	6,692 001900-1	2	1,600 00	1,934 86	3,534 0010	34	28,99!) 58	16,204 S7	45,204 45
I have just one more table-one relating to immigration from the United States. One reason why I am reading these tables on this occasion is that heretofore it has been very difficult to get any starting point, to ascertain how many people have come from a particular country, and at what cost; and if we start right now, I think we shall hereafter be able to get full statements of these matters. If this method is carried out, we shall have tables in which we can get the information we desire without having to peruse all the blue-books issued from year to year by the department. Before reading this table relating to the United States, I may say that this movement was started away back in 1891-92 bv the late government, and that country was looked on as a fruitful field for immigration agents to work in. I think it was a wise move, and -I will endorse any reasonable effort made by this government to bring immigrants of the proper character from the United States, because that country to-day Mr. WILSON.
gets a great many more of the right kind of immigrants than it did in former years. I am fully persuaded that if we get two or three more good crops in the North-west, we shall have a large immigration from the United States, whether we have any agents or not. I was told by a gentleman who deals in land in that country that it was the practice of speculators to go down to the northern states with maps and talk up the land, and sometimes they got capitalists to join with them, and they became immigrant agents of a very important kind. They had a great interest in making sales, because they participated in the profits. The following is the table regarding United States agents :	[DOT]
Approximate statement showing number of immigrant agents employed by the Dominion government each year in the United States of America, from July 1, 1891, to June 30, 1901, the total amount paid each year to the said agents for salaries, and the amount spent each year for printing and other expenses by said agents as follows :
Year.	No. of Agents	Salaries.	Printing and other Expenses.	Total.S cts.	$ cts.	$ cts.1891-2	19	9,221 19	12,668 19	21,88!) 381892 3	41	22,052 41	31,105 45	53,157 861893-4	33	15,614 03	30,297 75	45,911 781894-5	8	5,939 81	2,508 15	8,447 96181)5- (>	4	5,102 78	1,844 31	6,947 091896-7	12	4.880 30	6,352 09	11.232 391897-8	28	14,884 90	28,197 44	43,082 341898-9	23	16.316 35	29,277 35	45,593 701899-1900..	16	15,252 02	21,988 15	40,240 17900-1	27	18,957 98	30,161 12	49,119 0010	211	128,221 77	197,400 00	325,621 77

",Conservative (1867-1942),,Uriah Wilson,http://www.parl.gc.ca/parlinfo/Files/Parliamentarian.aspx?Item=4fa6e520-c225-437f-92e4-2fe6af783ace&Language=E&Section=ALL
36353,ca.proc.d.1902-04-17.4.7.6,1902-04-17,7b93f979-f291-49f1-9a5c-54d08800f177,ca.m.2348,Mr. SPROULE.,,SUPPLY-PREFERENTIAL TRADE WITHIN THE EMPIRE.,NAMES OF IMMIGRANT AGENTS WHOSE SALARIES WERE RAISED.,,"And commission agents besides ?

",Conservative (1867-1942),,Thomas Simpson Sproule,http://www.parl.gc.ca/parlinfo/Files/Parliamentarian.aspx?Item=7b93f979-f291-49f1-9a5c-54d08800f177&Language=E&Section=ALL
36354,ca.proc.d.1902-04-17.4.7.7,1902-04-17,4fa6e520-c225-437f-92e4-2fe6af783ace,ca.m.8941,Mr. WILSON.,,SUPPLY-PREFERENTIAL TRADE WITHIN THE EMPIRE.,NAMES OF IMMIGRANT AGENTS WHOSE SALARIES WERE RAISED.,,"Well, they go up into the hundreds. I did not take into account the commission agents, because I did not like to weary the House with masses of figures. I come now to what I consider most important and that is the manner in which the United States deals with its immigrants. About fifteen or twenty years ago, the United States found that crime was steadily increasing in that country, that the alms houses were being filled, and that the American people were being taxed enormously owing to their failure to give proper supervision to their immigrants. The United States government appointed a commission in 1888 to investigate, and I shall only read two or three brief extracts from the report of that commission. In the State of New York alone, the charities cost over $20,000,000, according to the sworn testimony of one of the witnesses. The commission found that in the older countries of Europe

there were not only societies established for the purpose of deporting the criminal classes, but the government even gave these societies grants from the public exchequer, and evidence was given to show that government officers in Germany opened the prison doors, brought the prisoners down to the steamers, and paid their passages to America. If the hon. gentleman wants to verify my statement from the report, I shall be glad to hand it to him. I can assure the hon. minister that he has moved altogether too slowly in this matter, and that we are being overrun by a class of immigrants, which the United States government will not allow into their country.
I was told that I should not give newspaper clippings, and I took the trouble to wait upon Mr. Watchorn, the principal inspector of the United States, whose territory reaches from St. John, N.B. to Saulf Ste. Marie in Michigan. He at first told me that he had no power to give the information I required. That information, he said, .was exclusively for his own government, and not for the newspapers or men who wanted to use it for their own purposes. But he told me that if I would apply to the department at Washington, I would no doubt get what I wanted. I forgot to mention that my attention was first called to this matter by the Montreal ' Star ' which, in its issue of the 22nd March, had a graphic description of the kind of people rejected. If any hon. gentleman has not read this article, I would be very glad to give it to him, and I assure the House that it would be well worth any one's while to read it. The following day the ' Star ' had an editorial, and people laughed at the idea of its being the truth or even near the truth. But Mr. Miller, who looked this matter up, is an energetic and a thoroughly reliable man. I wrote to Washington and was referred to Mr. Watchorn, and I got from him the following information :
United States Immigration Service,
Office of Special Immigrant Inspector, .
*	Port of Montreal, Canada,
233 St. Antoine St., April 12, 1902.
Hon. Uriah Wilson,
House of Commons,
Ottawa, Ont.
Dear Sir,-I desire to acknowledge receipt of your communication of the 11th instant, inclosing letter written to you by the Hon. T. V. Powderly, Commissioner-General of Immigration, Washington, D.C., and requesting me to furnish you as much information as possible, along the lines of your verbal inquiries, on the 4th instant.
The department rules, under which this office is working, do not admit of furnishing official information either to the public press, or to persons, such as yourself, who desire to obtain such information for their own use. However, lire above mentioned inclosure, suffices to indicate that my superior officers have no objection to my giving you such information as is available here, for your purpose; I therefore make the following ' statement, which I believe will
virtually cover the several points to which you gave prominence, in your list of questions :
The jurisdiction of this office extends from Sault Ste. Marie, Michigan, to St. John, N.B. Officers are stationed at the following places :
Three at Sault Ste. Marie, Mich., two at Sarnia, Ont., and Port Huron, Mich., five at Windsor, Ont., and Detroit, Mich., three at. Suspension Bridge, N.Y., four at International Bridge (Port Brie, Ont., and Black Rock, N.Y.), six at Montreal, P.Q., two at Cornwall, Ont., two at Vanceboro, Me., and one at each of the following plaees^-Malone, N.Y., Alburg, Vt., Rouses Point, N.Y., St. Albans, Vt., Newport, Vt., North Stratford, N.H., Hermingford, St. Ar-mand, St. Johns, Athelstan, P.Q., St. Thomas, Port Hope, Kingston, Brockville and Prescott, Out., Lowelltown and Calais, Maine.
In addition to the foregoing, there is a United States Commissioner of Immigration at the port of entry to Canada, who has a full complement of inspectors, interpreters, matron, and physician. AH European immigrants destined to the United States are supposed to be examined by this commissioner, and if found eligible to enter the United States, are given a specially prepared certificate of admission to the United States, and it devolves upon the force of officers under my jurisdiction, 1o take up these certificates at the border etptions (copies of certificates having been surrendered at the border inclosed) which are subsequently sent to Washington for cancellation.
Before I read any further I would like to say that, in my opinion, it would be a very easy matter for our government to make an arrangement with the United States, under which all parties, irrespective of Whether they go to American or Canadian ports, should be examined. If they are paupers, crippled or insane, or have any dangerous disease, or are found to be criminals, they should be sent back. Why should we consent to admit the off-scourings of creation into this country ?

",Conservative (1867-1942),,Uriah Wilson,http://www.parl.gc.ca/parlinfo/Files/Parliamentarian.aspx?Item=4fa6e520-c225-437f-92e4-2fe6af783ace&Language=E&Section=ALL
36355,ca.proc.d.1902-04-17.4.7.8,1902-04-17,intervention,,,,SUPPLY-PREFERENTIAL TRADE WITHIN THE EMPIRE.,NAMES OF IMMIGRANT AGENTS WHOSE SALARIES WERE RAISED.,,"Would my hon friend (Mr. Wilson) send me the letter ?	.

",,,The MINISTER OF THE INTERIOR.,
36356,ca.proc.d.1902-04-17.4.7.9,1902-04-17,4fa6e520-c225-437f-92e4-2fe6af783ace,ca.m.8941,Mr. WILSON.,,SUPPLY-PREFERENTIAL TRADE WITHIN THE EMPIRE.,NAMES OF IMMIGRANT AGENTS WHOSE SALARIES WERE RAISED.,,"I will when I get through with it, but I have not more than started it yet.
It was thought that the establishment of a United States commission at the Canadian port of entry would suffice to reject ail undesirable applicants for admission to the United States, as it is done at United States ports, but it transpired that very large numbers of immigrants intending to go to the United States, manifested themselves as Canadian passengers, and thus avoided the inspection of a United States force at _a Canadian port, and subsequently resumed ""their journey from their temporary abode, in Canada, to their original destination. Therefore other methods had to he adopted, to cope with this phase of the situation, hence the increase of the border force from a comparatively small number of inspectors, to the present force of forty-four.
Now. that is what our laws are doing for the United States. And, indeed, they are doing a good deal worse. It is a small matter to take a man's money, but it is a very serious matter to expose him to the risks

of associating with these families and others whom he meets. Though the United States are spending $100,000 a year on that service, they are not taxing their own people for it, but are making the immigrants or the steamship companies pay all this money. They are charging one dollar a head for every immigrant that enters their country, and there is a Bill before congress to increase the head-tax to $1.50. I believe that Bill will become law. The Minister of the Interior introduced a Bill in this House last night with reference to this matter. And I would advise him-if he thinks my advice of any value-to see the Bill that is now before congress before he presses forward his own. For, if he would reach an understanding with the people on the other side of the line we would save money and also save ourselves the annoyance of getting a lot of people who are of no use to anybody. I saw a man who came to Halifax, and wanted to go to New York. He was a little bit of a fellow. He had been unfortunate and lost one eye, the other eye was badly affected with trachoma. The United States officials rejected him. But he got hold of some society, and they gave him money enough to go to Niagara, and there they sent him back. They do not mince matters when any one tries to steal into that country when he has no certificate, and who is not a proper person to be admitted. They arrested him and put him on board a ship, and if they have to pay his way back they do so. But we ought not to do that. If any ship that brings people who are not fit immigrants, to this country, that ship ought to be obliged to take them back whence they came. I may be told that that is an extreme view, but perhaps I am a little extreme in some things.
It is incumbent upon all the border inspectors to demand a certificate of admission issued by the commissioner at the port -of entry, as a condition precedent to lawful admission. All alien immigrants minus said certificate of admission, are subject to detention, and rigidex-amination at the border, at the following places :-Sault Ste. Marie, Port Huron, Detroit, Niagara Falls and Montreal.
There are just a few places, you will notice, and, no matter where these immigrants come from they are sent to one of these places. I think Mr. Watchhorn is a first-class officer for the position. While he is courteous, he is firm, and tells them in very plain language what he thinks about them.
If an immigrant minus a certificate of admission, attempts to enter the United States at any other border station, it is imperatively necessary that the inspector on duty at such place shall return him to one or other of the aforementioned stations.
You will observe from the last report of the Commissioner General of Immigration, that only six persons were rejected along the Canadian border because they were suffering from loathsome contagious diseases. Investigations made by the Bureau in Europe, disclosed the fact that a tremenduous discrepancy was re-

",Conservative (1867-1942),,Uriah Wilson,http://www.parl.gc.ca/parlinfo/Files/Parliamentarian.aspx?Item=4fa6e520-c225-437f-92e4-2fe6af783ace&Language=E&Section=ALL
36357,ca.proc.d.1902-04-17.4.7.10,1902-04-17,4fa6e520-c225-437f-92e4-2fe6af783ace,ca.m.8941,Mr. WILSON.,,SUPPLY-PREFERENTIAL TRADE WITHIN THE EMPIRE.,NAMES OF IMMIGRANT AGENTS WHOSE SALARIES WERE RAISED.,,"presented, in those known to have emigrated from Europe to the United States via Canada, and those actually rejected at the border.
This discrepancy led to still further investigations, which together with the above-mentioned facts, resulted in the present somewhat rigorous system of border Inspection. The present system was inaugurated on September 1st, 1901, since which time, at all points of this jurisdiction, they have been rejected for various causes, more than one thousand European immigrants

Now, these immigrants were rejected because they were not fit to be citizens of the United States. Somebody said they were not fit mentally, morally, physically, or financially. I do not think that anybody in this country wants to be hard on a poor unfortunate. But I think, at the same time, that the country that has these unfortunates is much more bound to take care of them than are we in Canada.
-'and while some of them were rejected because of their total destitution, a very large majority of them have been rejected because they were suffering from loathsome contagious diseases, notably trachoma, a dangerous affection of the eye, -and favus, a loathsome affection of the scalp. Both these diseases are born of filth, and yield favourably to treatment, only when taken in their earliest stages.
You will observe, on page 34 of the Commissioners General's Report, that the Increase of immigration through Canada to the United States, from 1896 to 1990, has been very heavy, and is in fact very much in excess of what these figures indicate.
I think your official records will bear out the statement, that for the year endpd^June 30th, 1901, approximately fifty thousand immigrants arrived at Canadian seaports, twenty-four thousand destined for the United States, which leaves the inference to be drawn, that twenty-six thousand remained in Canada, but these figures are totally misleading, because of the twenty-six thousand credited to Canada, for the time specified, no less than three hundred per month were given certificates of admission to the United States, in Montreal alone, within thirty days of their arrival at a Canadian port. I would like to know now what the minister thinks of that, or what his deputy or what the superintendent of immigration thinks of it. If within thirty days of their landing' in Canada about four thousand people, of their own motion went to the United States, who had to be able to pass a most rigid examination-these people having been hilled for Canada originally-what would it be if we take the whole country over ? It does seem to me that It bears out pretty well the statement that I made two years ago. My hon. friend from Bothwell (Mr. Clancy) and some other hon. members and myself, went into a careful analysis of the immigration from the various countries, and we could not satisfy ourselves that we got more than 26,000, although we were reported to have got 44,000.
Assuming that a like ratio of admissions were made at other border stations (not at all an unreasonable assumption), it will be seen that more than half of the European immigration

credited to Canada has proceeded to the United States within thirty days after arrival, and there exists no doubt in my mind but a very large proportion of the other half have likewise proceeded to the States at more or less subsequent dates.
This is what Mr. Watchorn says, and I will show you the document I saw him sign myself.
I cannot better illustrate to you the difficulties under which we are labouring than to cite to you the fact that only this very day we .have had to send to New York, under a strong escort, under arrest by authority of warrants issued by the Secretary of the Treasury, fourteen immigrants suffering from favus and trachoma, who landed on the 31st of March last at St. John, N.B., all of whom are credited to Canada, but who, as you observe, are regarded as unfit for domicile in the United States (and who evidently did not wish to remain in Canada, despite their having been manifested thereto) .that they are being placed on board-steamers in New York harbour to-day and sent back to the country whence they came, at the expense of the United States government.
I saw the telegram saying that they had been safely put on board the steamship, and I would be very glad if the others to whom objection was made were put on board another steamship and carried back to the countries from which they came.
In addition to these fourteen sent to New York we have rejected forty-one other perspns similarly afflicted who were carried on the ship at the same time, but the latter forty-one, not having surreptitiously gone over the border, have been returned to various places in Canada -notably Windsor, Hamilton, Toronto and Montreal, where, so far as I know, they now are.
I am going to read all this letter for the reason that this gentleman says he takes no part whatever in Canadian politics, and he does not want one party to make any capital out of it against another party. He had no objection to the facts being given, but he did not want it to be supposed that he wished to favour one side more than another. Therefore I want to read this last part of the letter, although it does not appear to concern the immigration business ; but I am doing exactly what he expected me to do.
The same spirit that prompted me to be reluctant to comply with your request for information on the 4th instant, influences me to desire to avoid the very appearance of criticising cr attempting to criticise the way in which your honorable government sees fit to conduct its affairs, and I do not wish you to construe anything herein stated as casting any reflections on any person or persons whatsoever connected with your government. I give you the information for what it is worth, and venture to express the hope that, ere long, we shall find that your government, in its wisdom, has decided to exclude from Canada all persons suffering from loathsome, contagious diseases, and who are otherwise obviously and unmistakably subjects only of charity, public or private.	.
It has been found in the United States that as efforts have been put forth to exclude the
vicious, the diseased and the burdensome, in contrastive proportion, efforts have been increased on the part of the healthy, strong, vigorous, and desirable classes, to enter the United States.
HopiDg that what I have herein stated may In some measure serve the purpose of enlightening you and others through you who desire to become more or less familiar with the subject.
I remain, yours very respectfully,

",Conservative (1867-1942),,Uriah Wilson,http://www.parl.gc.ca/parlinfo/Files/Parliamentarian.aspx?Item=4fa6e520-c225-437f-92e4-2fe6af783ace&Language=E&Section=ALL
36358,ca.proc.d.1902-04-17.4.8,1902-04-17,,,,subtopic,SUPPLY-PREFERENTIAL TRADE WITHIN THE EMPIRE.,"ROBERT WATCHORN,",,,,,,
36359,ca.proc.d.1902-04-17.4.8.1.1,1902-04-17,,,,stagedirection,,,,". Special Immigrant Inspector.
Now I think I have fully complied with the promise I made in the beginning, that the proofs of my statements should be as nearly as possible official. This gentleman is in a position to know all about the people who are coming in to this country, because, as I said before, he is in charge of the whole force of inspectors from St. John, New Brunswick, to Sault Ste. Marie, in the west. I hope the minister will carefully consider not only the enormous amounts of money we are spending on immigration, but whether it would not be worth while to put a head tax upon steamship companies bringing immigrants to this country. Somebody said to me a while ago :	You don't
have to send immigrants to the Yukon, you can hardly keep them out. And my opinion is that if we have two or three more good seasons in Manitoba and the North-west we will have very little trouble in filling up that country.",,,,
