basepk,hid,speechdate,pid,opid,speakeroldname,speakerposition,maintopic,subtopic,subsubtopic,speechtext,speakerparty,speakerriding,speakername,speakerurl
36735,ca.proc.d.1902-04-18.1.6.71,1902-04-18,intervention,,,,SUPPLY-THE EXPORT OF NICKEL.,COMMD.NS 30S0,,"In regard to what will be done or what can be done, I shall not be able to say anything until the' supplementary estimates appear, and they will speak for themselves. 4.3 to the criticism which has been made on the action of the government with respect of the application for provincial autonomy-

",,,The MINISTER OF THE INTERIOR.,
36736,ca.proc.d.1902-04-18.1.6.72,1902-04-18,5e8a24b4-f155-4f3d-aacc-e6da13c93756,ca.m.4254,Mr. BORDEN (Halifax).,Leader of the Official Opposition,SUPPLY-THE EXPORT OF NICKEL.,COMMD.NS 30S0,,"Before the hon. gentleman leaves that point, might I ask him :	Has the government of the Northwest Territories any independent source of revenue apart from that which it derives from this grant ?
The MINISTER OF THE INTERIOR Nothing substantial. The local revenues of the North-west Territories are of a very-trivial description. I think they amount to not more than $30,000.

",Conservative (1867-1942),,Robert Laird Borden,http://www.parl.gc.ca/parlinfo/Files/Parliamentarian.aspx?Item=5e8a24b4-f155-4f3d-aacc-e6da13c93756&Language=E&Section=ALL
36737,ca.proc.d.1902-04-18.1.6.73,1902-04-18,21e66c9f-80d0-4275-bfd5-c4c5d918080a,ca.m.2472,Mr. SCOTT.,,SUPPLY-THE EXPORT OF NICKEL.,COMMD.NS 30S0,,"Last year they amounted to $80,000, and possibly this year they will

amount to $100,000, derived from the local land tax.

",Liberal,,Thomas Walter Scott,http://www.parl.gc.ca/parlinfo/Files/Parliamentarian.aspx?Item=21e66c9f-80d0-4275-bfd5-c4c5d918080a&Language=E&Section=ALL
36738,ca.proc.d.1902-04-18.1.6.74,1902-04-18,intervention,,,,SUPPLY-THE EXPORT OF NICKEL.,COMMD.NS 30S0,,"Respecting what has been said in connection with the conduct of the government upon the application of the territorial government for provincial autonomy, let me say I do not think that in respect to that application, that as yet at least there is any serious, reasonable grievance existing on the part of our territorial friends. The settlement of the constitutional and financial status of that vast territory is surely worth a little consideration. The time to consider the question, even in the opinion of the most urgent friends of provincial autonomy, did not arrive until a year ago. It was not suggested until about a year ago that the subject should be seriously considered, and if hon. gentlemen will remember how long it takes to settle questions of this kind and to settle them satisfactorily, I think they will admit that rash haste with regard to a question of such vast importance-a question which must be satisfactorily settled if settled at allrash haste would not at all be conducive to a settlement which would be satisfactory in the long run to the people of the territories. I would not feel that I was taking an unreasonable position before this House if I said : That if the people of the Northwest Territories get a reasonable and satisfactory settlement, a settlement that the people of Canada and the people of the territories particularly will regard as a good settlement; a fair and reasonable settlement promising permanency ; promising lack of agitation, and difficulties, and applications for re-opening of the case in future years-if they get such a settlement within three or four years I should feel very well satisfied indeed, and I should feel that we have accomplished that result in a comparatively short time. In saying that, I am not at this moment indicating any view I have just now as to when this question will be finally and definitely settled.
I wish to say in answer to my hon. friend for Macdonald (Mr. Boyd) whose face I see wearing a smile of a somewhat critical character-I wish to say a few words in regard to what he evidently has in his mind. He evidently has in his mind the idea that we are deterred from dealing with the constitutional question relating to the North-west Territories by the possible difficulty of the separate school question being raised in connection with that constitutional settlement. I think some of his friends are under the impression that the reason why we have not dealt with it at this session of parliament is, that there is some political game to be played, and that the party with which the government is identified hopes to gain something politically by reason of the delay. I am bound to say Mr. Chairman, so far as I am concerned and so far as I know, there is no
political advantage to be gained by either party in connection with the settlement of this question. I know of no political game that can be played, and so far as the separate schools are concerned my own view is that the school question is settled so far as the North-west Territories is concerned. I understand that the settlement at which they have arrived-and I am very happy to be able to express that opinion- is a satisfactory settlement, and that the Roman Catholic people on the one hand and the Protestant people on the other, feel that they have a satisfactory compromise and that there is no necessity for difficulty or agitation upon the question.

",,,The MINISTER OF THE INTERIOR.,
36739,ca.proc.d.1902-04-18.1.6.75,1902-04-18,intervention,,,,SUPPLY-THE EXPORT OF NICKEL.,COMMD.NS 30S0,,"Hear, hear.

",,,Some hon. MEMBERS,
36740,ca.proc.d.1902-04-18.1.6.76,1902-04-18,intervention,,,,SUPPLY-THE EXPORT OF NICKEL.,COMMD.NS 30S0,,"Therefore, I think we may possibly be able to look forward to a settlement of this constitutional question, at least when it is proposed by the government to this parliament, being carried out without any acrimonious discussion upon a question of that kind which might be a most difficult and unpleasant one to have to decide, if there were any contention upon it.
I gave certain reasons in the brief letter which I wrote to Mr. Haultain as to why the government did not feel disposed to deal with this question at the present time. Now, I have lived a great many years in the western portion of Canada and I think I have some little understanding of our people there. I sympathize with them, but I know that when they get an idea about a thing to be done they generally have an idea that it should be done right off. They are not disposed to allow the march of events to proceed very long without having a final settlement of what they claim ought to be settled. They are not generally desirous to listen to counsel which goes in the direction of delay. My hon. friend from Alberta (Mr. Oliver) has possibly been the clearest exponent of that principle which is generally followed by western people, and he puts it very well. He says :	We
have asked you for certain things and if you are not prepared to do just exactly what we say, why pay the shot and pay as much as we ask. My hon. friend (Mr. Oliver) forgets that he takes for granted the whole of the discussion and all the points involved in the discussion because he says :	We are entitled to what we ask
in the first place, and if you do not give us what we ask we are entitled to fix the amount you will give us. I think the House of Commons will hardly admit that that is the case, because we shall have to take the position, however much we sympathize with our friends in the North-west Territories, that there are two parties to the question of their financial status, and two parties to the question how much they ought to have. These questions cannot be settled by a logical proposition such as

my hon. friend from Alberta (Mr. Oliver) puts with such clearness. A good deal of thoughtful consideration will have to be given to the details.
I want to say a word on two phases of the question-what the position of the territories is, and whether it is desirable for them to have provincial autonomy at the present time. 1 am bound to say that 1 think the view expressed so strongly by certain gentlemen representing the territories is not justified by the facts, although there is considerable difference of opinion on the subject. They express the opinion that the financial difficulties of the territories would entirely disappear if they had provincial autonomy. Now, it has been pointed out-and it might be pointed out more in detail if it were necessary-that there are services performed by the government of Canada in the North-west Territories at the present time which are of an exceptional character, because of the exceptional position of that country. We maintain a large police force there; blit let not our friends think that that police force is maintained solely for what may be called Dominion purposes. Not at all. We require to maintain a force of some kind for Dominion purposes; but at present we maintain it not only for Dominion purposes, not only because it is desirable to have a military force in so large a territory, and where in former years at least there were a considerable number of Indians who were somewhat hostile in their tendency, but at the present time we maintain a large number of those policemen scattered about the country, singly or in groups of two or three, for the purpose of performing the duties of local constables; and if we undertook to remove one of those constables from the neighbourhood where he is placed, such a storm would arise os no minister would care to face. There is a stronger demand for local police in the North-west Territories than in any other part of Canada. I will not be so uncharitable as to say that it is so strong simply because the Federal government has to pay the shot; but the demand is there, and there is some reason for it, because at the present time and for some years to come the population will be so sparse that they will not be able to form themselves into local communities and by small local taxation give themselves the police protection which is provided in other parts of Canada. When the population of the North-west Territories increases to five of six hundred thousand, circumstances will be different. The people will be closer together, municipalities will be formed, we shall be able to collect our police force into military companies for military purposes, and the people will look after their own police protection. But that time has not *come yet, and that is one of the things that are to be considered in connection with this question. The territorial government would not be prepared to undertake any such ex-Hor,. Mr. SIFTON
penditure for police purposes, and if we withdrew that police force from local service, they would have to come back to the Dominion government and ask us again to undertake that kind of work.
There . are other circumstances which I think might well lead the House to take a year or two to consider the questions which have to be settled. We have in the Northwest Territories a vast extent of country, and if you will take the trouble to note the discussions which have taken place, you will find that the people who live in the district of West Assiniboia are almost unanimously in favour of immediate provincial autonomy and of the territories being constituted into one province, whereas in the neighbourhood of Indian Head, where the meeting was held to which my hon. friend from Macdonald (Mr. Boyd) refers, there is not that same amount of unanimity of opinion. My hon. friend said he was at a public meeting, where 1,000 people were present, and where there was a very unanimous expression of opinion ; and, if I understood him rightly, he said that he judged of the view of the meeting by the applause given to the speakers. I was not at the meeting, but I read a very full account of it made by a shortland reporter, to the effect, which I think was not disputed, that the meeting was a large and very intelligent one, that they gave.a reasonable and courteous reception and applause to the speakers on both sides, and assumed the attitude of intelligent men who had come to listen and consider the arguments that would be presented to them; and it can hardly be said that the people at that meeting, which assembled to hear Mr. Haultain on one side and Mi*. Roblin on the other side of the question, whether the territories should be formed into one province, or that portion of the territories should be united with the province of Manitoba, fully made up their minds on the question that evening. There is still some difference of opinion among the people. There is some sentiment in favour of that district being united to the province of Manitoba; but the prevailing sentiment is that it should remain a part of the Northwest Territories. If you go to the district of Saskatchewan, you will find an entirely different sentiment prevailing among the people there. They are not in favour of the territories being formed into one province, and they are not in a hurry for provincial autonomy; but when it comes they do not want their district to be united with the territory to the south. At the present time you have a vast territory there containing about 200,000 people. The census showed about 150,000 in the organized territories; there are perhaps 10,000 or 12,000 in the country to the north; and with the increment caused by the immigration of last year, there hre at the present time approximately about 200,000 people. The analogy as to the number of people who were in Manitoba when it became a member

of the confederation, or as to the number in British Columbia, does not hold at all, because those provinces were brought into confederation by way of a necessity which existed at that time. It was not in the deliberate exercise of the discretion of the parliament of Canada, thinking fhalt it would be an ideal or desirable state of affairs to have 17,000 people constituted into a province, that the province of Manitoba was formed. It was formed because the necessity arose. There were people there who demanded local powers, and the peaceful settlement of the country could not have been effected, and that territory could not have been brought under the rule of the Dominion of Canada, without those terms being granted at that time. Hon. gentlemen will remember that there was a rebellion, and it is possible that the trouble arose only on account of the- belief that was created by interested persons that the government here did not intend to give them provincial autonomy or to treat them fairly. They had to be treated in that way, because they were insisting that the existing status should be recognized, and it was recognized as a matter of necessity. British Columbia came in as a sovereign colony under a bargain made with the people of Canada, and the people of Canada had no choice in that respect. But -that is no reason for saying that when you get 17,000 people in a territory in any part of the Dominion of Canada, you are to form them into a province. That is not justified by common sense or by the precedents cited in favour of it. I think what parliament will be disposed to do will be to treat this question on a fair and liberal basis ; but they will desire, when they come to deal with it, to have before them sufficient data to enable them to feel that they are working out a settlement which has in it -the element of permanency. And 1 think parliament would be rather prepared for two or three or four years to vote sums of money, which might be reasonably arrived at as approximately what the territories actually require for their immediate necessities, and let us get more information with regard to what the position will be and what the necessary requirements of the territories will be, so that when we do arrive at a settlement, it shall have some of the elements of finality. At this late hour, I shall not undertake .to discuss the various details which will have to be considered in the formation of a province in the North-west. If lion, gentlemen will look through the Bill presented for our consideration by our friends from the territories, they will see at once that there are items in it quite sufficient to make any government take a little time for their consideration. We have in this Bill a provision that all mines, minerals, timber and royalties, belonging to the Crown, situated or arisiug in the territories, and all sums due and payable on the 1st of January, 1903, 9S
for such mines, minerals, timber and royalties shall belong to the province. In addition to other matters relating to the finances, which were supposed to be dealt with somewhat on the line, that has been taken in the other provinces, and as to which possibly no serious objection would be taken, there is a provision that the province shall be entitled to receive, by halfyearly payments in advance from the government of Canada, interest at 5 per cent per annum on the sum of one dollar per acre for every acre of land granted by the Dominion otherwise than as homesteads or pre-emption. I see some hon. members smiling, and I think I have convinced the committee that there is sufficient material in that Bill for a year's consideration. When I said that it was desirable that we should take a little time to consider, I do not think I was asking anything unreasonable. I did not discuss with premier Haultain the details of the Bill. I desire to say, in all frankness, to the committee, that-I did not think it desirable to discuss the details. I do not think it desirable, in a matter of such vast importanece to the people of Canada generally and of the territories in particular, to unnecessarily rush the government of Canada into a record on these questions. They are questions upon which a good deal of light may be thrown by further discussion. The circumstances during the last year were not propitious to a complete discussion of the question with the members of the North-west government, afld perhaps that is one of the most important features which I ought to bring before the House.

",,,The MINISTER OF THE INTERIOR.,
36741,ca.proc.d.1902-04-18.1.6.77,1902-04-18,57ed8b95-0f38-4d6d-9502-1000823660c3,ca.m.1041,Mr. INGRAM.,,SUPPLY-THE EXPORT OF NICKEL.,COMMD.NS 30S0,,"Did the delegates of the North-west Territories come down over a year ago to discuss the question with the hon. gentleman ?

",Liberal-Conservative,,Andrew B. Ingram,http://www.parl.gc.ca/parlinfo/Files/Parliamentarian.aspx?Item=57ed8b95-0f38-4d6d-9502-1000823660c3&Language=E&Section=ALL
36742,ca.proc.d.1902-04-18.1.6.78,1902-04-18,intervention,,,,SUPPLY-THE EXPORT OF NICKEL.,COMMD.NS 30S0,,"No, but it is pretty hard to make a categorical statement about what the members of the territorial government did come down to discuss. The hon. gentleman will appreciate that difficulty. I suppose that there has been no time when I have met the members of the North-west government-and I have met them every year since I have been Minister of the Interior-that I have not discussed with them, in a casual manner, the question of provincial autonomy.

",,,The MINISTER OF THE INTERIOR.,
36743,ca.proc.d.1902-04-18.1.6.79,1902-04-18,57ed8b95-0f38-4d6d-9502-1000823660c3,ca.m.1041,Mr. INGRAM.,,SUPPLY-THE EXPORT OF NICKEL.,COMMD.NS 30S0,,"I understood Premier Haultain and Mr. Ross were here a year ago and discussed this very question with the hon. gentleman.

",Liberal-Conservative,,Andrew B. Ingram,http://www.parl.gc.ca/parlinfo/Files/Parliamentarian.aspx?Item=57ed8b95-0f38-4d6d-9502-1000823660c3&Language=E&Section=ALL
