basepk,hid,speechdate,pid,opid,speakeroldname,speakerposition,maintopic,subtopic,subsubtopic,speechtext,speakerparty,speakerriding,speakername,speakerurl
39169,ca.proc.d.1902-04-28.10.7.38,1902-04-28,6f8757b8-14e1-4066-84f8-108affd94890,ca.m.4578,Air. DAVIS.,,QUESTIONS.,THE TRANSPORTATION PROBLEM.,,"My hon. friend from Selkirk (Air. AtcCreary) has just placed in Mr. 0SL3R.
my hands a report of the AATnnipeg Board of Trade which deals with the question that the hon. member for West Toronto (Mr. Osier) spoke about a moment ago, and which I wish to read to the House :
The tonnage of the Canadian lake vessels is not keeping pace with the annually increasing tonnage handled at Fort AVilliam, and it behooves Canadians to move in this matter with despatch, or an unduly increased percentage of Manitoba grain will seek the Atlantic seaboard via Buffalo and American lines. It is doubtful whether, if all the grain offered to the Canadian Pacific Railway last fall had been taken to Fort William, there would have been Canadian vessels to have taken it across the lakes, even when excluding the quantity actually taken to Buffalo in American bottoms. Late in the fall Buffalo was blocked, and owing to the coasting laws, American vessels were not allowed to carry grain from Fort William to another Canadian port. Either the Canadian fleet will have to be largely augmented or the coasting regulations suspended, for Manitoba grain cannot be held back at Fort William or Port Arthur, because the Canadian vessel tonnage is inadequate to handle it.

",Liberal,,Thomas Osborne Davis,http://www.parl.gc.ca/parlinfo/Files/Parliamentarian.aspx?Item=6f8757b8-14e1-4066-84f8-108affd94890&Language=E&Section=ALL
39170,ca.proc.d.1902-04-28.10.7.39,1902-04-28,4e01e3c6-73dc-40cf-8a42-e6156318db32,ca.m.3973,Air. OSLER.,,QUESTIONS.,THE TRANSPORTATION PROBLEM.,,"I think the AVinnipeg Board of Trade are like a great many other western institutions; they anticipate events that do not occur. They anticipate that there will not he a sufficiency of vessels to take out the grain. I made the statement that there were three vessels that were obliged to winter at Fort Wiiliam because there was not enough Afanitotoa wheat at Fort William ready for them to take out on their last trip, and in consequence they had to winter there for want of the cargo which they expected. There was no grain available for them.

",Conservative (1867-1942),,Edmund Boyd Osler,http://www.parl.gc.ca/parlinfo/Files/Parliamentarian.aspx?Item=4e01e3c6-73dc-40cf-8a42-e6156318db32&Language=E&Section=ALL
39171,ca.proc.d.1902-04-28.10.7.40,1902-04-28,intervention,,,,QUESTIONS.,THE TRANSPORTATION PROBLEM.,,"AVould American boats have loaded themselves with Canadian grain for American ports ?

",,,The AIINISTER OF PUBLIC WORKS.,
39172,ca.proc.d.1902-04-28.10.7.41,1902-04-28,b51f4134-46ce-4074-8ec8-9b889a8caa45,ca.m.5742,Air. DEPUTY SPEAKER.,Deputy Speaker and Chair of Committees of the Whole of the House of Commons,QUESTIONS.,THE TRANSPORTATION PROBLEM.,,"All this discussion is out of order; let the hon. gentleman (Air. Davis) proceed.

",Liberal,,Peter Macdonald,http://www.parl.gc.ca/parlinfo/Files/Parliamentarian.aspx?Item=b51f4134-46ce-4074-8ec8-9b889a8caa45&Language=E&Section=ALL
39173,ca.proc.d.1902-04-28.10.7.42,1902-04-28,6f8757b8-14e1-4066-84f8-108affd94890,ca.m.4578,Air. DAVIS.,,QUESTIONS.,THE TRANSPORTATION PROBLEM.,,"The hon. gentleman (Air. Osier) tells us that there was not sufficient grain with which to load these vessels. One of the reasons why there was not sufficient grain wias that .the Canadian Pacific Railway could not take the grain to the elevators. We had the grain in the west and if it had been brought down to Fort AVilliam these boats would not have been tied up. In reference to what the hon. gentleman said about the Winnipeg Board of Trade *ny hon. .friend (Mr. AIcCreary) informs me that 7,000,000 bushels of grain went via Duluth through American territory because the Canadian Pacific Railway could not bring it to a Canadian .port, which is a lamentable thing. That is what the Winnipeg Board of Trade wants to prevent, and I venture to say there is no body of men in the Dominion that knows as much about the question as the Winnipeg Board of Trade.

There is not a body in Canada that knows j more about grain than does the Winnipeg Board of Trade, and 1 would further point out to my hon. friend (Mr. Osier) that his partner Mr. Nanton is president of that board of trade, and Mr. Nanton is a business man and he knows what he is talking about. The Minister of Public Works said that something might happen that would enable the American railroads to squeeze us. Well, the position I took was that it might be necessary for the people of this country from a national standpoint, to build the Intercolonial Railway to Fort Simpson on the Pacific coast as a main artery controlled by the Canadian government, in vic-w of the fact that some day the Americans mav control the Canadian Pacific Railway, the Grand Trunk Railway and other Canadian roads. The hon. gentleman (Hon. Mr. Tarte) accused me of making the sweeping statement that our canal system was no good. I did not say that. I said that the canal system would always be valuable for local traffic, but that this was a railway age, and as the canal system was inadequate to serve the transportation purposes of the great North-west it would be necessary to secure transportation by railways. The Minister of Public Works told us that we spent $100,000,000 on the Canadian Pacific Railway. I wonder how he arrived at that figure. The report of the Canadian Pacific Railway Company shows that they still have 16,000,000 acres of land which is worth at least $4 an acre, and that represents $04,000,000. I was under the impression that we gave them $25,000,000 in hard cash, together with a completed portion of the road which cost the government $65,000,000, and that they got another 16,000,000 acres of land which would represent a further sum of $48,000,000. If the Minister of Public Works figures it out, he will find that the people of Canada gave the Canadian Pacific Railway $240,000,000 in lands and money, which is more than the whole system is valued at to-day. I complain that in view of all this we still have to pay the Canadian Pacific Railway exorbitant freight rates to carry our products. The Minister of Public Works told us that grain was carried 1,100 miles for 51 cents, and in view of the fact that we have to pay 8i cents for carrying it 448 miles, is not that a grievance that we suffer? He told us that the people of the North-west Territories were having $500,000 a year spent on immigration for their benefit. I believe that money is well spent but I never heard before that it was not spent in the interest of all Canada. Our immigration agents do not alone represent Manitoba and the North-west, but they represent the older provinces as well. Anyway, every dollar spent in Manitoba and the North-west Territories is a benefit to the whole Dominion. We are a producing people and we manufacture nothing. The money that we get
for our products comes to the east and helps to build up the eastern cities. We are proud of that, and what I said was that it was necessary to take other steps to bring the west and the east closer together, so that our trade might increase and so that a friendly feeling might exist. When I said that I spoke from a national standpoint. I repeat that the only solution to the difficulty is for the government to build one great national artery, or if they want to keep to the old policy of assisting companies, let them assist a company to build a great highway from the west to Quebec ox* some port that will be kept opened ten months in the year, so that we may have the advantage of a fair market price for our wheat and not be compelled to store it all winter. Suppose we raise 400,000,000 bushels of wheat in the west and have to store it during the winter months, then when that vast quantity would be put on the market in the spring of the year down would go the price, and the farmers would lose not six cents per bushel but perhaps twenty-five cents per bushel. We do not want anything unreasonable in the North-west, we point out here what is required, and when we do that we are only doing our duty to our constituents. We don't want any one to build granaries for us ; we want liberty to build our own granaries though, and we do not want legislation that gives a monopoly to the elevator combine. Give us the reasonable facilities which we want, and you will hear little more about complaints from the west.

",Liberal,,Thomas Osborne Davis,http://www.parl.gc.ca/parlinfo/Files/Parliamentarian.aspx?Item=6f8757b8-14e1-4066-84f8-108affd94890&Language=E&Section=ALL
39174,ca.proc.d.1902-04-28.10.7.43.1,1902-04-28,,,,stagedirection,,,,Motion agreed to.,,,,
39175,ca.proc.d.1902-04-28.10.8,1902-04-28,,,,subtopic,QUESTIONS.,GOVERNMENT RAILWAYS-WAGES OF TRACKMEN AND OTHER LABOURERS.,,,,,,
39176,ca.proc.d.1902-04-28.10.8.1,1902-04-28,687c4488-2a54-4da2-b396-df8a4613b4fb,ca.m.1822,Mr. HANCE J. LOGAN (Cumberland) moved :,,QUESTIONS.,GOVERNMENT RAILWAYS-WAGES OF TRACKMEN AND OTHER LABOURERS.,,"That considering ibe general prosperity of Canada, the minimum wage to be paid trackmen and other labourers on the government system ot railways should be at least one dollar and a halt per day.
He said :	Mr. Speaker, we have heard a
great deal to-night with reference to the west and I have a grievance to discuss in reference to the east. It is not the great transportation question it is true ; but still it is a question which concerns the working men on the government railways who have wives and families to support on small wages, and it is a question just as important to them as is the question we have been discussing to the farmers in the North-west Territories. I regret very much that the Minister of Railways and Canals is obliged to be absent this evening because I would have liked to address a few remarks particularly to him. I wish to speak Sir, on behalf of two classes of public employees who seem to have been neglected in the

",Liberal,,Hance James Logan,http://www.parl.gc.ca/parlinfo/Files/Parliamentarian.aspx?Item=687c4488-2a54-4da2-b396-df8a4613b4fb&Language=E&Section=ALL
39177,ca.proc.d.1902-04-28.10.8.2,1902-04-28,687c4488-2a54-4da2-b396-df8a4613b4fb,ca.m.1822,Mr. LOGAN.,,QUESTIONS.,GOVERNMENT RAILWAYS-WAGES OF TRACKMEN AND OTHER LABOURERS.,,"amount of credit for having raised the wages of many of the employees of the Intercolonial Railway. I refer particularly to the trainmen, the conductors, the brakemen, the drivers, the firemen, the telegraphers, and the station agents all along the line. The wages of these men have been increased by the present Minister of Railways ; and why is it that the wages of the trackmen, who have to work 10 hours a day, who have serious responsibilities, who are skilled workmen-because a man has to be a skilled workman to be able to look after any system of railways-are kept down to the pittance of $1.20 a day ? We send our immigration agents all over the world to bring men into Canada. It is a poor advertisement for Canada to have it go to the world that the government of this country pays its workingmen only $1.20 a day. Besides, these trackmen have devoted their lives to this work.
I know men in my own constituency who have worked on the railway for 20 years or more as trackmen ; and if they left their job to-morrow, although they are skilled men in keeping up and maintaining a railway, they would be unfitted to earn a livelihood at any other kind of work. In reference to the freight handlers, I may say that these men are compelled by the force of circumstances and the class of work they have to do, to be men of education, men who can read and \yrite well, and who are trustworthy and honest; and yet these men, who have serious responsibilities, who handle hundreds of thousands of dollars worth of freight, are compelled to work for $1.20 a day. Last year there was a strike of the trackmen of the Canadian Pacific Railway, and what was the answer of the company to the men who demanded higher wages ? There answer was, ' You cannot expect us, a soulless corporation, to give you more than the government of Canada pays to its men on the Intercolonial Railway.' It was that argument that killed the strike at that time, and the men were forced to go back to work. Within the last few weeks these men have been again negotiating with the Canadian Pacific Railway Company, and the company have agreed to increase their wages to $1.25 a day as the minimum rate and to pay more in towns and cities where the cost of living is high. They also agreed to leave the question of the wages of the trackmen to arbitration, in case the trackmen would not accept $1.25 per day. It seems to me that this country cannot afford to continue the present condition of affairs any longer. I am in close contact with these meu. I know many of them in my own constituency. I know their circumstances, and I cannot understand how under the sun a man can keep his family, with six, seven, eight or nine children in some eases, on $1.20 a day. My hon. friend from Montreal (Mr. Gallery) says that the city of Montreal pays $1.50 a day for labourers on the public streets. In the town of Amherst we have to

pay the men who work on the streets much higher wages than are paid on the government railway. It has a deteriorating effect on the workingmen of the country who know that the government does not pay its workingmen sufficient wages. Therefore, without taking up the time of the House at this late hour, I desire to call the attention of the government to this condition of affairs, on behalf of these workingmen, some of whom are among the very best citizens of the country, in the hope that they will immediately take this matter into their consideration, and increase the wages of the trackmen and the freight handlers to a sum that will enable them to keep their wives and children in greater comfort than they can do on their present rate of wages.

",Liberal,,Hance James Logan,http://www.parl.gc.ca/parlinfo/Files/Parliamentarian.aspx?Item=687c4488-2a54-4da2-b396-df8a4613b4fb&Language=E&Section=ALL
39178,ca.proc.d.1902-04-28.10.8.3,1902-04-28,b443ed18-8c97-4f61-a408-a844789acb40,ca.m.6066,"Mr. J. J. HUGHES (King's, P.E.I.).",,QUESTIONS.,GOVERNMENT RAILWAYS-WAGES OF TRACKMEN AND OTHER LABOURERS.,,"Mr. Speaker, I just rise to endorse and support and emphasize what the hon. member for Cumberland (Mr. Logan) has said. In his motion he takes in the government railways of Canada, but he confined (his remarks to the Intercolonial Railway. That was probably a mistake. I think that the government, in taking this matter into consideration, should certainly consider it as compre-hensably as the motion on the Order paper, which says the government railways, and consequently includes the Prince Edward Island railway. As a matter of fact, I know that young men who go on the railways and get positions as trackmen, by being saving and sober men, are simply able to support themselves. After some time perhaps they get married, but they are not able to support their families on the wages they receive ; and after they have acquired experience and become more valuable, they are obliged to leave the railway service, and take up some other occupation in order to make a living.
I do not think that such a condition of things ought to be allowed to continue in this country. As my hon. friend from Cumberland (Mr. Logan) has pointed out, the railway trackmen are above the ordinary labourer. Their work requires more intelligence, and in addition they have to be out in all kinds of weather and at all hours, which entails additional expenditure on clothing, etc. They have to provide themselves with suitable clothing to meet the conditions under which they labour or their health will be impaired, and I know of cases of men whose wages did not permit them to clothe themselves suitably to meet all kind of weather and support their families, in consequence of which their health suffered and they were obliged to quit work. Of recent years the cost of living in Canada has increased. It costs more to suppoi*t a family now than it did in former years. Clothing is dearer, rents are higher, and because of the great progress of the country a higher standard of living is necessary. In consequence of all these reasons and others which could be adduced, the wages paid the trackmen are not sufficient to enable them to support their families. The pay of all other men on the government railways has been increased fairly well, but the trackmen are kept just where they were several years ago. I earnestly hope that the government or the Minister of Railways will take up this matter and deal fairly and generously with these men, and I am sure that such a step would commend itself to the House and country.

",Liberal,,James Joseph Hughes,http://www.parl.gc.ca/parlinfo/Files/Parliamentarian.aspx?Item=b443ed18-8c97-4f61-a408-a844789acb40&Language=E&Section=ALL
39179,ca.proc.d.1902-04-28.10.8.4,1902-04-28,c2bdccdc-4bf7-488a-a812-d0156eae2e79,ca.m.3196,"Mr. DAN. GALLERY (Montreal, St. Anne's).",,QUESTIONS.,GOVERNMENT RAILWAYS-WAGES OF TRACKMEN AND OTHER LABOURERS.,,"While I am in entire sympathy with the remarks of the hon. gentlemen who have so well pleaded the cause of the trackmen, I regret that they should have confined themselves to that particular class of labour and other labour on the government railway. There are men employed on our canals whose claims deserve equal attention, and when the government is considering the justice of raising wages on the Intercolonial Railway, I would ask that the claims of these men employed on the canals should also be given some consideration. It seems to me that the minimum rate mentioned in this resolution should be made to apply generally, and if the government will go beyond the resolution when considering the question, and do justice to the conditions and claims of all classes of day labour in its employ, it will take a course that will gain for it' thq support of all the friends of labour in this country.

",Liberal,,Daniel Gallery,http://www.parl.gc.ca/parlinfo/Files/Parliamentarian.aspx?Item=c2bdccdc-4bf7-488a-a812-d0156eae2e79&Language=E&Section=ALL
39180,ca.proc.d.1902-04-28.10.8.5,1902-04-28,76a14a62-7837-4de0-b0d2-d237d71f8007,ca.m.4155,Mr. A. W. PUTTEE (Winnipeg).,,QUESTIONS.,GOVERNMENT RAILWAYS-WAGES OF TRACKMEN AND OTHER LABOURERS.,,"I wish to say a few words to express my sympathy with this resolution. It is one which I thoroughly endorse. I notice that it is directed particularly to the Minister of Railways and Canals, who is not in his place tonight, but I hope that its approval by this House will have the effect of causing him to put it into effect without delay. I would myself have preferred a resolution in more general terms; I would have preferred that the minimum of $1.50 per day should have been made applicable to all classes of labour in the service of the government and not merely to those in its railway service, and in urging that this minimum be fixed, I do not think it is necessary to make any special argument with regard to special training or skill or anything of the-kind. It should only be necessary to mention that the work is required to be done and that men have to be employed to do it. I do not think it is right that this government should hire men at any rate of wages which prevents their entering married life. The government should pay wages sufficient to enable every one employed by it to support a family and not a wage that compels him to remain single. We have on the Intercolonial Railway about 700 trackmen employed, and the

fact that they are not paid a sufficient wage has had a considerably wider effect than many people in the east may suppose. There are now about 12,000 trackmen employed on all the railways, exclusive of .the government road, and I believe that the wages of these men have been kept down during the past few years just because of the low price paid by the government. Other railway companies have pointed to the fact that the people's own employees were getting even less than these companies were paying. This argument was specially used in their strike last year. At present the question of wages on the Canadian Pacific Railway, affecting 6,000 or 8,000 men, is a matter for arbitration, and I believe that if the Minister of Railways would act on this resolution at once and grant the increase asked for, that would have an immediate effect on all other railway companies. I would rather this resolution were drawn in broader terms, because I notice there is a Bill before the House affecting the wages in the Post Office Department. Should that Bill become law the lowest rate paid in that department would be $1.25 per day, and I am totally opposed to this government admitting at all that any man, who is required to give his whole time to the government service, should receive as low as $1.25 per day, because under that rate no man is in a position to support a family.

",Independent Labour,,Arthur W. Puttee,http://www.parl.gc.ca/parlinfo/Files/Parliamentarian.aspx?Item=76a14a62-7837-4de0-b0d2-d237d71f8007&Language=E&Section=ALL
39181,ca.proc.d.1902-04-28.10.8.6,1902-04-28,05ffcd85-4168-4656-82c4-05a0c40faaae,ca.m.1687,Mr. H. R. EMMERSON (Westmoreland).,,QUESTIONS.,GOVERNMENT RAILWAYS-WAGES OF TRACKMEN AND OTHER LABOURERS.,,"I would like to ask the attention of the House for a few moments while I make reference to the position of the railway freight checkers and freight handlers. 1 fully endorse what has been said with respect to the sectionmen on the track of our government railways, but the freight handlers and freight checkers are obliged to work usually from thirteen to fifteen hours per day, and receive only $1.20, though their work is of a nature that requires some considerable education. I believe that there is a condition inserted in government contracts for public works, which requires the contractor not to pay a less wage than $1.25 per day, and it seems very inconsistent that this government, which insists on such a condition, should pay its own labourers only $1.20 per day.

",Liberal,,Henry Robert Emmerson,http://www.parl.gc.ca/parlinfo/Files/Parliamentarian.aspx?Item=05ffcd85-4168-4656-82c4-05a0c40faaae&Language=E&Section=ALL
39182,ca.proc.d.1902-04-28.10.8.7,1902-04-28,47b47c19-8fe1-4407-b84f-9029f6aec230,ca.m.2900,Mr. TAYLOR.,Chief Opposition Whip; Whip of the Conservative Party (1867-1942),QUESTIONS.,GOVERNMENT RAILWAYS-WAGES OF TRACKMEN AND OTHER LABOURERS.,,"In these growing times ?

",Conservative (1867-1942),,George Taylor,http://www.parl.gc.ca/parlinfo/Files/Parliamentarian.aspx?Item=47b47c19-8fe1-4407-b84f-9029f6aec230&Language=E&Section=ALL
39183,ca.proc.d.1902-04-28.10.8.8,1902-04-28,05ffcd85-4168-4656-82c4-05a0c40faaae,ca.m.1687,Mr. EMMERSON.,,QUESTIONS.,GOVERNMENT RAILWAYS-WAGES OF TRACKMEN AND OTHER LABOURERS.,,"Yes, in these progressive, prosperous days. I am sure that the Railway Department is entitled to great credit for what it has already done in this direction. Only a few years ago, previous to 1896, 90 cents and 99 cents per day were paid. The Minister of Railways increased their wages gradually, until now they have reached $1.20, and certainly the time has come when we should pay them a larger per diem allowance. In the railway department at Moncton, there have

",Liberal,,Henry Robert Emmerson,http://www.parl.gc.ca/parlinfo/Files/Parliamentarian.aspx?Item=05ffcd85-4168-4656-82c4-05a0c40faaae&Language=E&Section=ALL
