basepk,hid,speechdate,pid,opid,speakeroldname,speakerposition,maintopic,subtopic,subsubtopic,speechtext,speakerparty,speakerriding,speakername,speakerurl
36414,ca.proc.d.1902-04-17.4.9.7,1902-04-17,3f3a6135-5d1d-4167-ab81-0e1dbb2cd149,ca.m.3785,Mr. GOURLEY.,,SUPPLY-PREFERENTIAL TRADE WITHIN THE EMPIRE.,' COMMONS,,"I was loath to make any remarks on this question, because I am opposed to this whole grant in regard to immigration, not because I would not vote this sum or double the sum if I believed there was an earnest desire to get people into this Hon. Mr. SIFTON.
country, but because I do not believe that the appropriation is properly expended. I am in accord with the minister in his statement, that immigration is the great need of Canada. I listened with pleasure, when he told us, that 50,000 people had come into this country, but I have listened to that kind of statement so often, when my own party was in power and since, and I have so often been disappointed in its accuracy, that I have learned to be very cautious. Whenever the census, comes around, we find, that such statements are not true, and I venture to say that at the end of ten years more, the 50,000 immigrants, announced by the hon. Minister of the Interior, will not be found on Canadian soil. I desire to attack this whole vote because the system of expenditure must be unscientific and unsystematic from beginning to end. If it be true, as stated by my hon. friend from Grenville (Mr. Reid), that a number of the friends of the hon. Minister of the Interior, occupy high positions and receive large salaries, in these offices, and if this grant of money, is used simply for the general purpose of giving offices to the friends of the hon. Minister of the Interior, then I can quite understand why the results have been so unsatisfactory. It is a lovely thing for the Minister of the Interior to be generous. It was counted a beautiful thing in the old times for a feudal chief to settle all his retainers in homes where they could acquire a living. If the hon. gentleman (Hon. Mr. Sifton) is to use this grant, as a feudal chief, for the purpose of giving all his retainers offices, then if these officers, recognize only that the gift of the office is simply a grant of favour, from the Minister of the Interior, I can understand why the immigration service is so unsatisfactory to this country.
I want to assist the Minister of the Interior to bring immigrants to this country, and before I sit down, I think, I shall be able to suggest, one or two, practical ways in which that can be done. I think we should recast, the whole system of expenditure, in this country, for immigration purposes. I do not defend the old system ; I know very little about it. I, presume that the Minister of the Interior, like his colleagues in the cabinet, has put on the old clothes of the Conservative party ; but the old clothes of the Conservative party may be worn out, and not fitted to clothe the new ministry in these days, and in this particular instance, the policy of the Conservative party, if the hon. gentleman has followed it, was not a wise policy. But there is an excuse, for the Conservative party.
It had to grapple with the building of the Intercolonial Railway and the Canadian Pacific Railway ; it had to create a nation out of a few scattered fragments ; it had to frame a national policy.
It was engaged in occupations which would draw its attention away from a question like immigration, which were not

as dominant as the questions to which I have referred. Now, however, the policy of the country is settled; all the great line's of transportation have been established: and hon. gentlemen opposite have nothing to do but to look after the mere details of then-respective offices. Therefore, I advocate a recasting of our immigration policy, on lines which will be conducive to the prosperity of Canada. I was struck with the remarks of the hon. member for Labelle (Mr. Bou-rassa) with regard to the people of England, and I understand why the real results of immigration to Canada are so meagre and unsatisfactory. If a prominent map-publishing firm in England, which publishes maps of every country in the world, can so . utterly misrepresent the geography of an old country like Canada, we can have some realization, of the ignorance of Canada, that exists in that country. We must look, largely to England, for our immigration. We must look largely to England, to give [DOT]the cue to the old world, as to the most desirable. country, on this continent for immigrants to come to, and any minister who desires to create a wise immigration policy, must direct his efforts, to convincing England, that Canada is that country, else his policy will fail. If Englishmen, who are our kin and blood, will not, come to our shores, who will ? I see that during the past year some 450,000 people have gone to the United States, a great many of them from the British isles, and a great many from countries, which are dominated, in public sentiment and commerce, by England. Why is it that these immigrants, go to the United States, instead of Canada ? There is just one explanation : The Minister of the Interior, has not made Canada well known in the old land. If that is true-if that map is published, in the way, it is said to be, with Montreal, the commercial capital of Canada, which should be as well known as the commercial capital of the United States, as New York or Boston-if Montreal can be placed in the United States, by an English geographer, then I say, the first duty, which we must perform, before we can expect much British immigration to this country, is to educate the people of England, and make them aware of our position on the map. and of the immense possibilities of Canada. I think that is the whole solution of this problem. This attempt to waste half a million dollars, by employing uneducated people, who perhaps could not earn a living here or anywhere, to go to the old country, and attempt to divert immigration, to this country, is folly of the most striking character. We all know, that the people of England. are influenced by caste, by social distinctions ; and there should be three or four men of high social position employed in England to take charge of our immigration, in order to give a character, and in order to tell the people who are about to immigrate, that Canada is the country to
which they ought to go. Unless we do this,
I can understand that the people of England, who are so much influenced by caste, by social position, more perhaps than any other people, might easily say :	' This
Canada is an unknown country ; I have heard very little about it; I will go to the United States, about which T have heard so much, and which fills the eye of the world to the exclusion of Canada.' The point I wish to make is this, that the first duty of this government, this year, is to sit down with the English cabinet, or with that portion of It, which may be charged, with considering the welfare of the colonies, and discuss this question of immigration with -them from beginning to end ; for I am persuaded that until you can get the government of England, with its vast ramifications, of power, and its official importance, and influence, to take hold of this question, and to -make it, its business, to assist this country-and it ought to be the pride and pleasure of Englishmen to do that -the results of our immigration policy will be disappointing and -not what they ought to be. Our ministers should say to the government of England : ' The greatest export you have to-day, the greatest capital you have -to distribute to the world, are the -strong, healthy men and women, who go out from your shores ; and you could not confer on the United States a greater gift than to send them eVery year 100,000 or 150,000 of these strong men and women ; but if you are looking to the colonies for aid, if you expect them -to stand by you in the hour o-f -stress, and difficulty, what you ought to do, is to help u-s to increase the population of Canada, which is a country, of splendid climate and great resources ; then in a few years we shall build you a nation, of fifteen or perhaps -thirty million of people, and after that is accomplished, England, need not fear, the world in arms, against her. The government of Canada, is to-day, largely, a matter of administration. Hon. gentlemen, on the Treasury benches, occupy the h-ap-py position, of being the inheritors of eighteen years o-f the1, most distinguished statesmanship the world has ever witnessed. They are, I may say, the unworthy inheritors of this good fortune, because if they were honourable, respectful heirs, they would be on their feet, every day, declaring that they were grateful, to -such distinguished men as Sir Charles Tupper and Sir John Macdonald, who provided the magnificent inheritance which they enjoy. Is it not a most extraordinary thing, that hon. gentlemen opposite, enjoy an inheritance which they never worked -to create, for to-day the government of Canada is the easiest government in the world; to administer. Everything has been prepared and since the government of Canada, has come to -be largely, a mere matter of administration, this question of immigration is a most important one, and I think the government is censurable, -in -not having ad-

railway, while the United States, in ten years, built sixty thousand miles. They have in the vicinity two hundred thousand miles of railway-as much as all the rest of the world put together. That is why the United States became great and dominant. They had great men, men of ambition, men of ideas,' men of strong imagination. One of the newspapers said the other day that I had imagination. No man is fit to be in parliament, or to attempt to do anything for Canada, unless he has imagination. Too many of our public men have not this part of a statesman's equipment. Blake had no imagination, when he made that historic speech, about the Canadian Pacific Railway, not being able to earn its axle grease. That was the trouble with the man-lack of imagination-and he went to the wall. We need, here, men of imagination, men of heart and feeling and sympathy. If we had, had, men of that kind, during the last sixty years, Canada would have been an equal competitor with the United States. We had Sir John Macdonald. He was a great lion, but, unfortunately, he could not exercise his magnificent powers, because there were thousands, of small men, attacking him on every side. But, in spite, of all they could do, he did achieve extraordinary things for Canada. But, what could he not have done, had he been backed, by an enthusiastic and generous parliament in his great imaginative schemes ? What 1 urge, upon hon. gentlemen opposite, is to imitate Sir John-at a reverent distance, for they can never approach him in statesmanship. If they do that, I will applaud them, and say : You have done the best, that God, ever fitted you to do. I urge them to go to Mr. Chamberlain, and lay, the oase before him. Let them sit down with Lord Salisbury, and urge him to be informed, with regard to Canada. Tell him that by reason of the splendid position he occupies in England, if he will, he can, lend Canada powerful aid. He makes speeches, at the Mansion House, and elsewhere, on every subject, except the colonies. Let them induce him to go to the Mansion House, and make a speech about Canada. If you are to attract, the attention, of the people of England, to Canada, you must have speeches made about Canada, by the men, to whom Englishmen, are accustomed to look, for direction in public affairs. And, without that, all that our ministers and others can do, will have but little result. Let these gentlemen, ask Mr. Chamberlain, to devote six months, to the question of upbuilding Canada, and assure him, the people of Canada, will heartily reciprocate, by adding to the strength of the empire. I think the Finance Minister, would be a good representative for sucli work, for his diplomatic ways in Nova Scotia are well known. Besides, I think, there is an ingenuity about the Nova Scotian, that always, stands him in good stead. I urge attention, to broad Mr. GOURLEY.
and far-reaching purposes. We debate little twopenny-ha'penny questions about men getting ten cents a pound for sugar and so much for bacon

",Conservative (1867-1942),,Seymour Eugene Gourley,http://www.parl.gc.ca/parlinfo/Files/Parliamentarian.aspx?Item=3f3a6135-5d1d-4167-ab81-0e1dbb2cd149&Language=E&Section=ALL
36415,ca.proc.d.1902-04-17.4.9.8,1902-04-17,intervention,,,,SUPPLY-PREFERENTIAL TRADE WITHIN THE EMPIRE.,' COMMONS,,"Hear, hear.

",,,Some hon. MEMBERS,
36416,ca.proc.d.1902-04-17.4.9.9,1902-04-17,3f3a6135-5d1d-4167-ab81-0e1dbb2cd149,ca.m.3785,Mr. GOURLEY.,,SUPPLY-PREFERENTIAL TRADE WITHIN THE EMPIRE.,' COMMONS,,"All that is very important, and it shows that even little things do not escape the attention of the opposition, but I would rather that the government would indulge in these little peculations undiscovered ; that these men should make two or three hundred thousand dollars improperly, than that they should refuse to engage in a great and comprehensive system of immigration, by which we can get the surplus population of the British Islands. Everybody in Canada would support the government in this policy. This government has a si>lendid opportunity- they have a loyal and patriotic opposition to assist them. We, on the other hand, always had an opposition, that seemed to be opposed, to the country. We join with the government, and if a man comes to this country, he will hear every Conservative from Nova Scotia to British Columbia praising Canada. Let them bring the people here, and the opposition, will undertake to fill them, with the most patriotic notions of Canada, so that they will never leave. Therefore, this government have a chance, that they never gave us, when we were in power. But, so far as I am concerned, I will not find fault with them further, if only they will do better. To err is human, and these hon. gentlemen opposite know it well. Let them take up this great question with the statesmen of Great Britain. Let them stop these petty salaries to these favourites, and devise a system, based upon the recognition, by the statesmen of England, of the fact, that they ought to help us. Instead of sending five or six agents to England, whose work must be practically useless, let them tell the men who have England's affairs in charge : If you will help us in immigration matters, it will cement this country to you,, more than anything else that you can do in a decade of years.
Holding these views, I undertake to say, that the immigration estimate after this will form an occasion for a field fight, unless a new system is adopted. I am here only in the interests of Canada, I have noother object on earth while here to serve.
I like my own country, better than I like myself, and my own interests, and I desire only to serve my country. I would like to help this country along, I want to see it the grandest country on earth, because I expect to live forty or fifty years longer, coming as I do from a strong and healthy breed ; and I expect to see this country the dominant power on this continent. If Enggland will help us, if she will take advantage of the present national feeling, if she will take Canada by the hand and give us her emigration, we shall go on conquering and to conquer.

",Conservative (1867-1942),,Seymour Eugene Gourley,http://www.parl.gc.ca/parlinfo/Files/Parliamentarian.aspx?Item=3f3a6135-5d1d-4167-ab81-0e1dbb2cd149&Language=E&Section=ALL
36417,ca.proc.d.1902-04-17.4.9.10,1902-04-17,0b047697-48e1-471d-8442-d7795241ec88,ca.m.7878,Mr. ROBINSON (Elgin).,,SUPPLY-PREFERENTIAL TRADE WITHIN THE EMPIRE.,' COMMONS,,"I am afraid that the member for Colchester (Mr. Gour-lay) is too pessimistic altogether. The member for Colchester ought to know that the greatest and most intelligent minds in England know nearly everything about Canada. Some of the best men in England have been, governors of this country, such as Earl Dufferin, Lord Aberdeen, the Marquis of Lome, Earl of Derby and others, who have advertised this country, and are doing it still. I think the member for Colchester has not been properly informed if he thinks that one example of an illiterate topographer who made a mistake in that map shown by the hon. member for Labelle (Mr. Bourassa), represents the ignorance of the English people with regard to Canada. I know that the people of England generally are well acquainted with the map of British North America. The reason why Englishmen do not come to Canada in greater numbers is because England has such immense territories to fill up in other parts of the world. She has colonized Australia within the last fifty years, she has colonized New Zealand, she is colonizing South Africa. Wherever the sun shines, wherever there is money to be made, Englishmen are always ready to go. If we will wait our time England will fill up this country the same as she is filling up others. I think the immigration office is doing its duty. A few days ago I saw in a newspaper published in the Midland counties of England a letter written by Lord Strathcona, the Canadian High Commissioner, setting forth reasons why the English peasantry should emigrate to Canada. I know that Lord Strathcona has bought at his own expense a great number of maps and distributed them among the schools of England, and the immigration department also has sent descriptive maps to the rural schools of England. I think it is only a question of time when the people of the British Isles will find that Canada is an excellent field for emigrants.
But there is another point to which I wish to call attention. We should be very careful whom we send there to represent us. If we send men there of the stamp and enthusiasm of the member for Colchester, they will bring out immigrants in multitudes ; there will not be enough vessels in England to bring the people that will want to come after they hear the member for Colchester speak. But if we send men like the individual we have heard about to-day, who says that he is making no effort to bring Irishmen to this country, that he does not urge them to come, that he would rather they stayed at home, then we cannot expect the British people to come here. We have got to be very careful whom we send. We artist send men who are loyal to our country and are loyal to Great Britain. I am sorry indeed to learn that 95
this government selected as immigration agent a man who is not loyal to our country.
I think this government should take steps to bring out the best class of people that can be found. We heard last session from the hon. member for Alberta (Mr. Oliver) that the class of people they were bringing out were very indifferent We know that the class of people we are sprung from are not indifferent, and we must make an effort to bring more of them here. There is one good reason why Immigration from the British Isles is at a low ebb just now. For the last two or three years a great many of their young men have been required to fill up the ranks in order to keep the empire together. We know too that the county councils, the township councils, the urban councils in England have gone into works of public improvement such as sewage work, the supply of towns with water, and these works afford employment to a great many men. Very few men will leave their home when they can get a fair living. I think that the immigration department are making an effort to fill up the vast territories we have in the west. The lust year's crop has well advertised our country and the men who are already settled there are writing letters back to their friends in the old country, and these letters will do far more to bring out people than the immigration department are doing.

",Independent,,Jabel Robinson,http://www.parl.gc.ca/parlinfo/Files/Parliamentarian.aspx?Item=0b047697-48e1-471d-8442-d7795241ec88&Language=E&Section=ALL
36418,ca.proc.d.1902-04-17.4.9.11,1902-04-17,47b47c19-8fe1-4407-b84f-9029f6aec230,ca.m.2900,Mr. TAYLOR.,Chief Opposition Whip; Whip of the Conservative Party (1867-1942),SUPPLY-PREFERENTIAL TRADE WITHIN THE EMPIRE.,' COMMONS,,"I want to inform my hon. friend from Grenville (Mr. Reid) that he is labouring under a mistake if he thinks Mr. Jury is serving his time in Liverpool for $1,200 a year. If he wil turn to the Auditor General's Report, L-15, he will find that Mr. Jury gets a salary of $1,800 a year, and $897 for his board, and that he draws in perquisites $10,205.16 for maintaining that little office on a back street. I also want to tell the minister that we on this side of the House are pretty well acquainted with Mr. Jury. The hon. minister said that if we knew him as well as he did we would know him to be a man of ability. I think he is just as well known to most of us as he is to the minister, because, previous to the advent to power of hon. gentlemen opposite, Mr. Jury, who was a Toronto tailor and a Liberal agitator, travelled through -this country speaking in the interests of hon. gentlemen opposite. We know pretty well who Mr. Jury is. He came into my county and into my town and stumped against me during my first or second election-I forget which. We are pretty well acquainted with Mr. Jury and we do not think he has the qualifications of a good immigration agent, although he is good on the platform as a lecturer. I do not think, being a Toronto tailor, that he would be able to enlighten the farmers very much on the question of how to farm. The hon. minister did not reply to the inquiry I made as to what he wanted with these 101,500



copy books at four cents apiece. He paid $4,0G0 to his friends in London, the Reid Bros, for these copy books. I want to know in what way they were used to assist immigration.

",Conservative (1867-1942),,George Taylor,http://www.parl.gc.ca/parlinfo/Files/Parliamentarian.aspx?Item=47b47c19-8fe1-4407-b84f-9029f6aec230&Language=E&Section=ALL
36419,ca.proc.d.1902-04-17.4.9.12,1902-04-17,intervention,,,,SUPPLY-PREFERENTIAL TRADE WITHIN THE EMPIRE.,' COMMONS,,"We conceived the idea of having a number of copy books prepared and circulated in the schools of Great Britain in which the head lines were statements in regard to Canada, and in which the facts respecting the geography, resources and that sort of thing were briefly summarized. We had these prepared and circulated in the schools so that the children using these copy books would acquire a knowledge of Canada. We had replies from a large number of people connected with these schools of a very complimentary character, and I am quite satisfied that this has proved a very effective means of disseminating knowledge and of giving practical information to the school children of Great Britain.

",,,The MINISTER OF THE INTERIOR.,
36420,ca.proc.d.1902-04-17.4.9.13,1902-04-17,47b47c19-8fe1-4407-b84f-9029f6aec230,ca.m.2900,Mr. TAYLOR.,Chief Opposition Whip; Whip of the Conservative Party (1867-1942),SUPPLY-PREFERENTIAL TRADE WITHIN THE EMPIRE.,' COMMONS,,"I think the hon. minister should supply each member of the opposition with a copy of all these productions.

",Conservative (1867-1942),,George Taylor,http://www.parl.gc.ca/parlinfo/Files/Parliamentarian.aspx?Item=47b47c19-8fe1-4407-b84f-9029f6aec230&Language=E&Section=ALL
36421,ca.proc.d.1902-04-17.4.9.14,1902-04-17,intervention,,,,SUPPLY-PREFERENTIAL TRADE WITHIN THE EMPIRE.,' COMMONS,,"I should be most happy to do so.

",,,The MINISTER OF THE INTERIOR.,
36422,ca.proc.d.1902-04-17.4.9.15,1902-04-17,47b47c19-8fe1-4407-b84f-9029f6aec230,ca.m.2900,Mr. TAYLOR.,Chief Opposition Whip; Whip of the Conservative Party (1867-1942),SUPPLY-PREFERENTIAL TRADE WITHIN THE EMPIRE.,' COMMONS,,"I have not seen a copy of it.

",Conservative (1867-1942),,George Taylor,http://www.parl.gc.ca/parlinfo/Files/Parliamentarian.aspx?Item=47b47c19-8fe1-4407-b84f-9029f6aec230&Language=E&Section=ALL
36423,ca.proc.d.1902-04-17.4.9.16,1902-04-17,intervention,,,,SUPPLY-PREFERENTIAL TRADE WITHIN THE EMPIRE.,' COMMONS,,"Now that my attention is drawn to that I may say that when there is anything of special importance got out I generally direct that copies be sent to every member of the House tout, this being a small thing published in Great Britain, no attention was paid to it.

",,,The MINISTER OF THE INTERIOR.,
